var clients = {"45.177.25.9":[{"date":"15/1/2012","time":"1:58:10","ip":"45.177.25.9","method":"OPTIONS","location":"/next","status":"404","datetime":"2012-01-15T00:58:10.302Z"},{"date":"13/2/2012","time":"18:49:48","ip":"45.177.25.9","method":"PUT","location":"/job/3","status":"201","datetime":"2012-02-13T17:49:48.302Z"},{"date":"22/5/2012","time":"2:26:12","ip":"45.177.25.9","method":"PUT","location":"/other","status":"500","datetime":"2012-05-22T00:26:12.302Z"},{"date":"16/6/2012","time":"22:31:39","ip":"45.177.25.9","method":"POST","location":"/job/2","status":"202","datetime":"2012-06-16T20:31:39.302Z"},{"date":"18/6/2012","time":"20:33:8","ip":"45.177.25.9","method":"DELETE","location":"/prev","status":"403","datetime":"2012-06-18T18:33:08.302Z"},{"date":"4/7/2012","time":"11:30:32","ip":"45.177.25.9","method":"PUT","location":"/last","status":"409","datetime":"2012-07-04T09:30:32.302Z"},{"date":"8/7/2012","time":"17:51:11","ip":"45.177.25.9","method":"GET","location":"/prev","status":"404","datetime":"2012-07-08T15:51:11.302Z"},{"date":"14/7/2012","time":"18:11:17","ip":"45.177.25.9","method":"DELETE","location":"/job/2/output","status":"204","datetime":"2012-07-14T16:11:17.302Z"},{"date":"1/8/2012","time":"21:49:26","ip":"45.177.25.9","method":"OPTIONS","location":"/resource2","status":"200","datetime":"2012-08-01T19:49:26.302Z"},{"date":"8/8/2012","time":"14:28:50","ip":"45.177.25.9","method":"DELETE","location":"/job/1/output","status":"204","datetime":"2012-08-08T12:28:50.302Z"},{"date":"15/9/2012","time":"1:31:26","ip":"45.177.25.9","method":"POST","location":"/job/2","status":"404","datetime":"2012-09-14T23:31:26.302Z"},{"date":"5/10/2012","time":"2:57:10","ip":"45.177.25.9","method":"GET","location":"/job","status":"308","datetime":"2012-10-05T00:57:10.302Z"},{"date":"13/12/2012","time":"12:15:1","ip":"45.177.25.9","method":"PUT","location":"/resource/edit","status":"405","datetime":"2012-12-13T11:15:01.302Z"},{"date":"30/1/2013","time":"1:48:13","ip":"45.177.25.9","method":"PUT","location":"/job","status":"200","datetime":"2013-01-30T00:48:13.302Z"},{"date":"6/2/2013","time":"4:18:45","ip":"45.177.25.9","method":"PUT","location":"/resource2","status":"400","datetime":"2013-02-06T03:18:45.302Z"},{"date":"19/2/2013","time":"17:26:2","ip":"45.177.25.9","method":"OPTIONS","location":"/","status":"404","datetime":"2013-02-19T16:26:02.302Z"},{"date":"21/2/2013","time":"3:9:17","ip":"45.177.25.9","method":"OPTIONS","location":"/resource","status":"200","datetime":"2013-02-21T02:09:17.302Z"},{"date":"23/3/2013","time":"18:57:41","ip":"45.177.25.9","method":"OPTIONS","location":"/next","status":"200","datetime":"2013-03-23T17:57:41.302Z"},{"date":"23/5/2013","time":"23:10:22","ip":"45.177.25.9","method":"OPTIONS","location":"/job/3","status":"200","datetime":"2013-05-23T21:10:22.302Z"},{"date":"31/5/2013","time":"9:16:27","ip":"45.177.25.9","method":"OPTIONS","location":"/next","status":"404","datetime":"2013-05-31T07:16:27.302Z"},{"date":"22/6/2013","time":"7:54:47","ip":"45.177.25.9","method":"GET","location":"/job/3","status":"308","datetime":"2013-06-22T05:54:47.302Z"},{"date":"30/6/2013","time":"10:3:0","ip":"45.177.25.9","method":"PUT","location":"/other","status":"401","datetime":"2013-06-30T08:03:00.302Z"},{"date":"9/8/2013","time":"22:25:36","ip":"45.177.25.9","method":"GET","location":"/job/3","status":"303","datetime":"2013-08-09T20:25:36.302Z"},{"date":"24/8/2013","time":"7:23:31","ip":"45.177.25.9","method":"GET","location":"/job/3","status":"308","datetime":"2013-08-24T05:23:31.302Z"},{"date":"26/8/2013","time":"17:58:43","ip":"45.177.25.9","method":"OPTIONS","location":"/job","status":"200","datetime":"2013-08-26T15:58:43.302Z"},{"date":"3/9/2013","time":"9:51:16","ip":"45.177.25.9","method":"POST","location":"/job","status":"405","datetime":"2013-09-03T07:51:16.302Z"},{"date":"30/9/2013","time":"10:23:14","ip":"45.177.25.9","method":"POST","location":"/resource","status":"202","datetime":"2013-09-30T08:23:14.302Z"},{"date":"2/10/2013","time":"15:38:42","ip":"45.177.25.9","method":"POST","location":"/last","status":"405","datetime":"2013-10-02T13:38:42.302Z"},{"date":"3/10/2013","time":"19:37:52","ip":"45.177.25.9","method":"PUT","location":"/","status":"409","datetime":"2013-10-03T17:37:52.302Z"},{"date":"9/10/2013","time":"14:11:45","ip":"45.177.25.9","method":"POST","location":"/job/1/output","status":"401","datetime":"2013-10-09T12:11:45.302Z"},{"date":"16/11/2013","time":"0:52:57","ip":"45.177.25.9","method":"DELETE","location":"/job/2/output","status":"405","datetime":"2013-11-15T23:52:57.302Z"},{"date":"16/11/2013","time":"4:5:30","ip":"45.177.25.9","method":"POST","location":"/job/2","status":"400","datetime":"2013-11-16T03:05:30.302Z"},{"date":"19/11/2013","time":"15:30:24","ip":"45.177.25.9","method":"DELETE","location":"/other","status":"500","datetime":"2013-11-19T14:30:24.302Z"},{"date":"3/12/2013","time":"12:33:39","ip":"45.177.25.9","method":"POST","location":"/","status":"400","datetime":"2013-12-03T11:33:39.302Z"},{"date":"10/12/2013","time":"2:14:58","ip":"45.177.25.9","method":"PUT","location":"/job/3","status":"405","datetime":"2013-12-10T01:14:58.302Z"},{"date":"23/12/2013","time":"20:8:9","ip":"45.177.25.9","method":"POST","location":"/prev","status":"405","datetime":"2013-12-23T19:08:09.302Z"},{"date":"12/1/2014","time":"1:48:15","ip":"45.177.25.9","method":"DELETE","location":"/job/2/output","status":"500","datetime":"2014-01-12T00:48:15.302Z"},{"date":"16/1/2014","time":"5:19:58","ip":"45.177.25.9","method":"POST","location":"/job/3","status":"405","datetime":"2014-01-16T04:19:58.302Z"},{"date":"17/1/2014","time":"19:9:55","ip":"45.177.25.9","method":"OPTIONS","location":"/resource2","status":"200","datetime":"2014-01-17T18:09:55.302Z"},{"date":"10/2/2014","time":"23:43:22","ip":"45.177.25.9","method":"GET","location":"/job/2/output","status":"404","datetime":"2014-02-10T22:43:22.302Z"},{"date":"6/4/2014","time":"1:37:52","ip":"45.177.25.9","method":"OPTIONS","location":"/first","status":"200","datetime":"2014-04-05T23:37:52.302Z"},{"date":"27/4/2014","time":"23:8:5","ip":"45.177.25.9","method":"OPTIONS","location":"/job/3","status":"404","datetime":"2014-04-27T21:08:05.302Z"},{"date":"4/5/2014","time":"16:25:57","ip":"45.177.25.9","method":"POST","location":"/resource/edit","status":"403","datetime":"2014-05-04T14:25:57.302Z"},{"date":"19/5/2014","time":"17:36:48","ip":"45.177.25.9","method":"POST","location":"/job/3","status":"202","datetime":"2014-05-19T15:36:48.302Z"},{"date":"14/6/2014","time":"0:24:21","ip":"45.177.25.9","method":"GET","location":"/job/2/output","status":"404","datetime":"2014-06-13T22:24:21.302Z"},{"date":"17/6/2014","time":"7:53:56","ip":"45.177.25.9","method":"OPTIONS","location":"/prev","status":"404","datetime":"2014-06-17T05:53:56.302Z"},{"date":"20/6/2014","time":"17:12:4","ip":"45.177.25.9","method":"GET","location":"/other","status":"303","datetime":"2014-06-20T15:12:04.302Z"},{"date":"11/7/2014","time":"23:4:27","ip":"45.177.25.9","method":"GET","location":"/job","status":"404","datetime":"2014-07-11T21:04:27.302Z"},{"date":"1/9/2014","time":"14:50:13","ip":"45.177.25.9","method":"OPTIONS","location":"/resource","status":"404","datetime":"2014-09-01T12:50:13.302Z"},{"date":"22/9/2014","time":"10:55:24","ip":"45.177.25.9","method":"OPTIONS","location":"/","status":"200","datetime":"2014-09-22T08:55:24.302Z"},{"date":"26/9/2014","time":"10:3:51","ip":"45.177.25.9","method":"POST","location":"/job/1/output","status":"200","datetime":"2014-09-26T08:03:51.302Z"},{"date":"3/10/2014","time":"14:6:29","ip":"45.177.25.9","method":"PUT","location":"/prev","status":"403","datetime":"2014-10-03T12:06:29.302Z"},{"date":"20/10/2014","time":"13:29:13","ip":"45.177.25.9","method":"OPTIONS","location":"/prev","status":"200","datetime":"2014-10-20T11:29:13.302Z"},{"date":"29/10/2014","time":"18:22:19","ip":"45.177.25.9","method":"DELETE","location":"/job/2/output","status":"405","datetime":"2014-10-29T17:22:19.302Z"},{"date":"4/12/2014","time":"3:32:8","ip":"45.177.25.9","method":"POST","location":"/prev","status":"400","datetime":"2014-12-04T02:32:08.302Z"},{"date":"20/12/2014","time":"19:14:12","ip":"45.177.25.9","method":"PUT","location":"/job/3","status":"409","datetime":"2014-12-20T18:14:12.302Z"},{"date":"30/1/2015","time":"12:41:53","ip":"45.177.25.9","method":"OPTIONS","location":"/other","status":"200","datetime":"2015-01-30T11:41:53.302Z"},{"date":"7/2/2015","time":"20:0:19","ip":"45.177.25.9","method":"OPTIONS","location":"/other","status":"404","datetime":"2015-02-07T19:00:19.302Z"},{"date":"23/2/2015","time":"22:55:43","ip":"45.177.25.9","method":"GET","location":"/resource/edit","status":"301","datetime":"2015-02-23T21:55:43.302Z"},{"date":"7/3/2015","time":"2:57:16","ip":"45.177.25.9","method":"GET","location":"/prev","status":"200","datetime":"2015-03-07T01:57:16.302Z"},{"date":"17/3/2015","time":"21:27:43","ip":"45.177.25.9","method":"OPTIONS","location":"/first","status":"404","datetime":"2015-03-17T20:27:43.302Z"},{"date":"23/3/2015","time":"12:8:1","ip":"45.177.25.9","method":"GET","location":"/resource1","status":"403","datetime":"2015-03-23T11:08:01.302Z"},{"date":"10/6/2015","time":"16:44:44","ip":"45.177.25.9","method":"DELETE","location":"/prev","status":"500","datetime":"2015-06-10T14:44:44.302Z"},{"date":"9/7/2015","time":"15:54:29","ip":"45.177.25.9","method":"DELETE","location":"/other","status":"403","datetime":"2015-07-09T13:54:29.302Z"},{"date":"14/7/2015","time":"6:54:40","ip":"45.177.25.9","method":"GET","location":"/next","status":"403","datetime":"2015-07-14T04:54:40.302Z"},{"date":"23/7/2015","time":"9:8:0","ip":"45.177.25.9","method":"DELETE","location":"/first","status":"405","datetime":"2015-07-23T07:08:00.302Z"},{"date":"15/8/2015","time":"1:5:50","ip":"45.177.25.9","method":"DELETE","location":"/other","status":"500","datetime":"2015-08-14T23:05:50.302Z"},{"date":"11/9/2015","time":"4:8:33","ip":"45.177.25.9","method":"DELETE","location":"/job","status":"500","datetime":"2015-09-11T02:08:33.302Z"},{"date":"24/9/2015","time":"14:21:45","ip":"45.177.25.9","method":"GET","location":"/job/2","status":"200","datetime":"2015-09-24T12:21:45.302Z"},{"date":"27/10/2015","time":"7:20:15","ip":"45.177.25.9","method":"PUT","location":"/job","status":"200","datetime":"2015-10-27T06:20:15.302Z"},{"date":"12/11/2015","time":"16:16:51","ip":"45.177.25.9","method":"POST","location":"/job/3","status":"500","datetime":"2015-11-12T15:16:51.302Z"},{"date":"15/11/2015","time":"6:59:26","ip":"45.177.25.9","method":"POST","location":"/other","status":"404","datetime":"2015-11-15T05:59:26.302Z"},{"date":"8/12/2015","time":"20:22:53","ip":"45.177.25.9","method":"POST","location":"/first","status":"400","datetime":"2015-12-08T19:22:53.302Z"},{"date":"5/1/2016","time":"23:28:5","ip":"45.177.25.9","method":"OPTIONS","location":"/job","status":"200","datetime":"2016-01-05T22:28:05.302Z"},{"date":"4/5/2016","time":"8:40:29","ip":"45.177.25.9","method":"GET","location":"/last","status":"308","datetime":"2016-05-04T06:40:29.302Z"},{"date":"7/5/2016","time":"0:1:19","ip":"45.177.25.9","method":"OPTIONS","location":"/other","status":"404","datetime":"2016-05-06T22:01:19.302Z"},{"date":"31/5/2016","time":"2:13:8","ip":"45.177.25.9","method":"GET","location":"/resource2","status":"500","datetime":"2016-05-31T00:13:08.302Z"},{"date":"17/6/2016","time":"5:30:18","ip":"45.177.25.9","method":"POST","location":"/job/1/output","status":"200","datetime":"2016-06-17T03:30:18.302Z"},{"date":"13/7/2016","time":"10:8:55","ip":"45.177.25.9","method":"DELETE","location":"/resource","status":"500","datetime":"2016-07-13T08:08:55.302Z"},{"date":"30/7/2016","time":"21:41:55","ip":"45.177.25.9","method":"GET","location":"/other","status":"500","datetime":"2016-07-30T19:41:55.302Z"},{"date":"6/8/2016","time":"14:15:14","ip":"45.177.25.9","method":"POST","location":"/resource2","status":"403","datetime":"2016-08-06T12:15:14.302Z"},{"date":"17/10/2016","time":"14:30:52","ip":"45.177.25.9","method":"OPTIONS","location":"/resource/edit","status":"200","datetime":"2016-10-17T12:30:52.302Z"},{"date":"11/12/2016","time":"11:57:58","ip":"45.177.25.9","method":"POST","location":"/resource1","status":"400","datetime":"2016-12-11T10:57:58.302Z"},{"date":"22/12/2016","time":"9:10:2","ip":"45.177.25.9","method":"POST","location":"/next","status":"200","datetime":"2016-12-22T08:10:02.302Z"},{"date":"6/2/2017","time":"4:26:24","ip":"45.177.25.9","method":"OPTIONS","location":"/job/3","status":"404","datetime":"2017-02-06T03:26:24.302Z"},{"date":"9/2/2017","time":"1:40:31","ip":"45.177.25.9","method":"DELETE","location":"/job/2","status":"400","datetime":"2017-02-09T00:40:31.302Z"},{"date":"2/3/2017","time":"7:7:21","ip":"45.177.25.9","method":"GET","location":"/resource2","status":"401","datetime":"2017-03-02T06:07:21.302Z"},{"date":"17/4/2017","time":"2:57:4","ip":"45.177.25.9","method":"DELETE","location":"/job/1","status":"403","datetime":"2017-04-17T00:57:04.302Z"},{"date":"31/5/2017","time":"9:13:27","ip":"45.177.25.9","method":"POST","location":"/resource","status":"405","datetime":"2017-05-31T07:13:27.302Z"},{"date":"7/6/2017","time":"11:47:47","ip":"45.177.25.9","method":"OPTIONS","location":"/other","status":"404","datetime":"2017-06-07T09:47:47.302Z"},{"date":"15/6/2017","time":"1:40:58","ip":"45.177.25.9","method":"OPTIONS","location":"/prev","status":"200","datetime":"2017-06-14T23:40:58.302Z"},{"date":"7/7/2017","time":"5:35:29","ip":"45.177.25.9","method":"GET","location":"/job","status":"403","datetime":"2017-07-07T03:35:29.302Z"},{"date":"31/8/2017","time":"5:51:23","ip":"45.177.25.9","method":"OPTIONS","location":"/other","status":"200","datetime":"2017-08-31T03:51:23.302Z"},{"date":"9/9/2017","time":"10:9:14","ip":"45.177.25.9","method":"OPTIONS","location":"/job/2","status":"404","datetime":"2017-09-09T08:09:14.302Z"},{"date":"16/9/2017","time":"9:45:49","ip":"45.177.25.9","method":"DELETE","location":"/job/2/output","status":"500","datetime":"2017-09-16T07:45:49.302Z"},{"date":"22/9/2017","time":"0:3:24","ip":"45.177.25.9","method":"DELETE","location":"/other","status":"400","datetime":"2017-09-21T22:03:24.302Z"},{"date":"16/12/2017","time":"7:0:13","ip":"45.177.25.9","method":"GET","location":"/resource/edit","status":"303","datetime":"2017-12-16T06:00:13.302Z"},{"date":"10/1/2018","time":"9:22:41","ip":"45.177.25.9","method":"PUT","location":"/","status":"405","datetime":"2018-01-10T08:22:41.302Z"},{"date":"12/2/2018","time":"14:33:7","ip":"45.177.25.9","method":"GET","location":"/","status":"404","datetime":"2018-02-12T13:33:07.302Z"}],"56.162.113.79":[{"date":"1/1/2012","time":"14:40:8","ip":"56.162.113.79","method":"PUT","location":"/job/3","status":"405","datetime":"2012-01-01T13:40:08.303Z"},{"date":"2/1/2012","time":"3:42:47","ip":"56.162.113.79","method":"PUT","location":"/job/3","status":"201","datetime":"2012-01-02T02:42:47.303Z"},{"date":"3/1/2012","time":"4:0:15","ip":"56.162.113.79","method":"GET","location":"/job/2/output","status":"308","datetime":"2012-01-03T03:00:15.303Z"},{"date":"31/1/2012","time":"21:11:8","ip":"56.162.113.79","method":"POST","location":"/other","status":"200","datetime":"2012-01-31T20:11:08.303Z"},{"date":"1/2/2012","time":"20:0:18","ip":"56.162.113.79","method":"GET","location":"/resource1","status":"403","datetime":"2012-02-01T19:00:18.303Z"},{"date":"10/2/2012","time":"10:16:3","ip":"56.162.113.79","method":"POST","location":"/resource1","status":"200","datetime":"2012-02-10T09:16:03.303Z"},{"date":"29/2/2012","time":"21:21:37","ip":"56.162.113.79","method":"PUT","location":"/last","status":"405","datetime":"2012-03-01T20:21:37.303Z"},{"date":"14/3/2012","time":"13:54:42","ip":"56.162.113.79","method":"OPTIONS","location":"/job/3","status":"404","datetime":"2012-03-14T12:54:42.303Z"},{"date":"15/3/2012","time":"14:16:32","ip":"56.162.113.79","method":"GET","location":"/prev","status":"200","datetime":"2012-03-15T13:16:32.303Z"},{"date":"17/3/2012","time":"9:35:59","ip":"56.162.113.79","method":"POST","location":"/job","status":"405","datetime":"2012-03-17T08:35:59.303Z"},{"date":"20/3/2012","time":"12:14:5","ip":"56.162.113.79","method":"POST","location":"/prev","status":"400","datetime":"2012-03-20T11:14:05.303Z"},{"date":"15/4/2012","time":"4:43:54","ip":"56.162.113.79","method":"OPTIONS","location":"/resource/edit","status":"200","datetime":"2012-04-15T02:43:54.303Z"},{"date":"21/4/2012","time":"19:11:9","ip":"56.162.113.79","method":"PUT","location":"/","status":"500","datetime":"2012-04-21T17:11:09.303Z"},{"date":"21/6/2012","time":"13:34:22","ip":"56.162.113.79","method":"GET","location":"/resource2","status":"403","datetime":"2012-06-21T11:34:22.303Z"},{"date":"28/6/2012","time":"11:30:7","ip":"56.162.113.79","method":"OPTIONS","location":"/other","status":"200","datetime":"2012-06-28T09:30:07.303Z"},{"date":"15/7/2012","time":"3:35:29","ip":"56.162.113.79","method":"POST","location":"/job/1","status":"500","datetime":"2012-07-15T01:35:29.303Z"},{"date":"26/7/2012","time":"0:37:1","ip":"56.162.113.79","method":"DELETE","location":"/resource1","status":"500","datetime":"2012-07-25T22:37:01.303Z"},{"date":"6/9/2012","time":"14:37:4","ip":"56.162.113.79","method":"OPTIONS","location":"/job/1","status":"200","datetime":"2012-09-06T12:37:04.303Z"},{"date":"8/9/2012","time":"6:33:33","ip":"56.162.113.79","method":"POST","location":"/first","status":"202","datetime":"2012-09-08T04:33:33.303Z"},{"date":"1/10/2012","time":"4:59:14","ip":"56.162.113.79","method":"PUT","location":"/job/2","status":"400","datetime":"2012-10-01T02:59:14.303Z"},{"date":"6/10/2012","time":"11:56:31","ip":"56.162.113.79","method":"POST","location":"/job/3","status":"200","datetime":"2012-10-06T09:56:31.303Z"},{"date":"14/10/2012","time":"3:27:14","ip":"56.162.113.79","method":"PUT","location":"/first","status":"401","datetime":"2012-10-14T01:27:14.303Z"},{"date":"15/10/2012","time":"5:6:51","ip":"56.162.113.79","method":"PUT","location":"/job/2","status":"409","datetime":"2012-10-15T03:06:51.303Z"},{"date":"31/10/2012","time":"9:51:6","ip":"56.162.113.79","method":"DELETE","location":"/","status":"204","datetime":"2012-10-31T08:51:06.303Z"},{"date":"27/11/2012","time":"8:49:5","ip":"56.162.113.79","method":"GET","location":"/resource1","status":"307","datetime":"2012-11-27T07:49:05.303Z"},{"date":"2/12/2012","time":"8:30:46","ip":"56.162.113.79","method":"OPTIONS","location":"/resource","status":"404","datetime":"2012-12-02T07:30:46.303Z"},{"date":"7/12/2012","time":"23:31:46","ip":"56.162.113.79","method":"POST","location":"/other","status":"202","datetime":"2012-12-07T22:31:46.302Z"},{"date":"9/12/2012","time":"3:2:16","ip":"56.162.113.79","method":"DELETE","location":"/job/3","status":"403","datetime":"2012-12-09T02:02:16.303Z"},{"date":"25/12/2012","time":"17:59:29","ip":"56.162.113.79","method":"DELETE","location":"/job/2/output","status":"400","datetime":"2012-12-25T16:59:29.303Z"},{"date":"11/2/2013","time":"22:41:6","ip":"56.162.113.79","method":"OPTIONS","location":"/job/1/output","status":"404","datetime":"2013-02-11T21:41:06.303Z"},{"date":"31/3/2013","time":"20:42:59","ip":"56.162.113.79","method":"GET","location":"/","status":"200","datetime":"2013-03-31T18:42:59.303Z"},{"date":"3/4/2013","time":"9:25:57","ip":"56.162.113.79","method":"PUT","location":"/job/3","status":"400","datetime":"2013-04-03T07:25:57.303Z"},{"date":"11/4/2013","time":"14:8:38","ip":"56.162.113.79","method":"DELETE","location":"/next","status":"405","datetime":"2013-04-11T12:08:38.303Z"},{"date":"21/4/2013","time":"8:22:58","ip":"56.162.113.79","method":"DELETE","location":"/","status":"404","datetime":"2013-04-21T06:22:58.303Z"},{"date":"11/6/2013","time":"7:39:18","ip":"56.162.113.79","method":"PUT","location":"/last","status":"201","datetime":"2013-06-11T05:39:18.303Z"},{"date":"23/6/2013","time":"22:38:16","ip":"56.162.113.79","method":"GET","location":"/job/1","status":"303","datetime":"2013-06-23T20:38:16.303Z"},{"date":"11/7/2013","time":"16:5:12","ip":"56.162.113.79","method":"DELETE","location":"/resource","status":"404","datetime":"2013-07-11T14:05:12.303Z"},{"date":"14/7/2013","time":"12:47:7","ip":"56.162.113.79","method":"PUT","location":"/prev","status":"500","datetime":"2013-07-14T10:47:07.303Z"},{"date":"15/7/2013","time":"13:55:32","ip":"56.162.113.79","method":"GET","location":"/job/2","status":"404","datetime":"2013-07-15T11:55:32.303Z"},{"date":"19/7/2013","time":"2:35:19","ip":"56.162.113.79","method":"PUT","location":"/last","status":"405","datetime":"2013-07-19T00:35:19.303Z"},{"date":"28/7/2013","time":"6:57:43","ip":"56.162.113.79","method":"PUT","location":"/resource1","status":"405","datetime":"2013-07-28T04:57:43.303Z"},{"date":"31/7/2013","time":"6:23:55","ip":"56.162.113.79","method":"GET","location":"/next","status":"401","datetime":"2013-07-31T04:23:55.303Z"},{"date":"7/8/2013","time":"22:50:18","ip":"56.162.113.79","method":"GET","location":"/resource","status":"200","datetime":"2013-08-07T20:50:18.303Z"},{"date":"17/9/2013","time":"4:40:8","ip":"56.162.113.79","method":"POST","location":"/resource2","status":"202","datetime":"2013-09-17T02:40:08.303Z"},{"date":"12/10/2013","time":"0:37:51","ip":"56.162.113.79","method":"OPTIONS","location":"/job/3","status":"200","datetime":"2013-10-11T22:37:51.303Z"},{"date":"15/11/2013","time":"3:18:24","ip":"56.162.113.79","method":"POST","location":"/job/3","status":"201","datetime":"2013-11-15T02:18:24.303Z"},{"date":"15/11/2013","time":"6:10:37","ip":"56.162.113.79","method":"OPTIONS","location":"/next","status":"200","datetime":"2013-11-15T05:10:37.303Z"},{"date":"26/11/2013","time":"9:43:42","ip":"56.162.113.79","method":"OPTIONS","location":"/job/1/output","status":"404","datetime":"2013-11-26T08:43:42.303Z"},{"date":"5/12/2013","time":"1:51:13","ip":"56.162.113.79","method":"PUT","location":"/job/2","status":"401","datetime":"2013-12-05T00:51:13.303Z"},{"date":"23/12/2013","time":"4:21:29","ip":"56.162.113.79","method":"OPTIONS","location":"/job/3","status":"404","datetime":"2013-12-23T03:21:29.303Z"},{"date":"9/1/2014","time":"13:31:55","ip":"56.162.113.79","method":"OPTIONS","location":"/job/3","status":"404","datetime":"2014-01-09T12:31:55.303Z"},{"date":"3/2/2014","time":"2:46:53","ip":"56.162.113.79","method":"GET","location":"/","status":"303","datetime":"2014-02-03T01:46:53.303Z"},{"date":"27/2/2014","time":"9:52:5","ip":"56.162.113.79","method":"OPTIONS","location":"/job/1/output","status":"200","datetime":"2014-02-27T08:52:05.303Z"},{"date":"13/3/2014","time":"7:41:15","ip":"56.162.113.79","method":"POST","location":"/resource","status":"201","datetime":"2014-03-13T06:41:15.302Z"},{"date":"8/4/2014","time":"1:0:42","ip":"56.162.113.79","method":"PUT","location":"/last","status":"400","datetime":"2014-04-07T23:00:42.303Z"},{"date":"15/4/2014","time":"3:27:20","ip":"56.162.113.79","method":"POST","location":"/job/3","status":"404","datetime":"2014-04-15T01:27:20.303Z"},{"date":"5/5/2014","time":"22:19:57","ip":"56.162.113.79","method":"PUT","location":"/job/2","status":"409","datetime":"2014-05-05T20:19:57.303Z"},{"date":"16/5/2014","time":"21:33:34","ip":"56.162.113.79","method":"GET","location":"/first","status":"301","datetime":"2014-05-16T19:33:34.303Z"},{"date":"2/7/2014","time":"23:14:42","ip":"56.162.113.79","method":"OPTIONS","location":"/resource1","status":"404","datetime":"2014-07-02T21:14:42.303Z"},{"date":"4/7/2014","time":"12:57:10","ip":"56.162.113.79","method":"POST","location":"/","status":"201","datetime":"2014-07-04T10:57:10.303Z"},{"date":"6/8/2014","time":"10:57:32","ip":"56.162.113.79","method":"POST","location":"/job/3","status":"201","datetime":"2014-08-06T08:57:32.303Z"},{"date":"27/8/2014","time":"21:30:49","ip":"56.162.113.79","method":"GET","location":"/other","status":"301","datetime":"2014-08-27T19:30:49.303Z"},{"date":"17/9/2014","time":"6:53:50","ip":"56.162.113.79","method":"PUT","location":"/resource","status":"403","datetime":"2014-09-17T04:53:50.303Z"},{"date":"25/10/2014","time":"17:14:3","ip":"56.162.113.79","method":"PUT","location":"/other","status":"409","datetime":"2014-10-25T15:14:03.303Z"},{"date":"25/11/2014","time":"8:6:48","ip":"56.162.113.79","method":"PUT","location":"/job/2/output","status":"409","datetime":"2014-11-25T07:06:48.303Z"},{"date":"11/12/2014","time":"9:9:48","ip":"56.162.113.79","method":"OPTIONS","location":"/job","status":"200","datetime":"2014-12-11T08:09:48.303Z"},{"date":"2/1/2015","time":"16:48:53","ip":"56.162.113.79","method":"PUT","location":"/other","status":"201","datetime":"2015-01-02T15:48:53.303Z"},{"date":"5/3/2015","time":"17:2:57","ip":"56.162.113.79","method":"PUT","location":"/job/1","status":"401","datetime":"2015-03-05T16:02:57.303Z"},{"date":"26/5/2015","time":"18:22:15","ip":"56.162.113.79","method":"PUT","location":"/resource2","status":"201","datetime":"2015-05-26T16:22:15.303Z"},{"date":"4/6/2015","time":"13:38:54","ip":"56.162.113.79","method":"PUT","location":"/job/2/output","status":"500","datetime":"2015-06-04T11:38:54.303Z"},{"date":"16/6/2015","time":"13:33:6","ip":"56.162.113.79","method":"PUT","location":"/prev","status":"400","datetime":"2015-06-16T11:33:06.303Z"},{"date":"19/8/2015","time":"14:6:22","ip":"56.162.113.79","method":"POST","location":"/other","status":"405","datetime":"2015-08-19T12:06:22.303Z"},{"date":"30/8/2015","time":"17:4:38","ip":"56.162.113.79","method":"POST","location":"/job/3","status":"405","datetime":"2015-08-30T15:04:38.303Z"},{"date":"15/11/2015","time":"10:34:5","ip":"56.162.113.79","method":"PUT","location":"/first","status":"200","datetime":"2015-11-15T09:34:05.303Z"},{"date":"17/11/2015","time":"1:57:52","ip":"56.162.113.79","method":"POST","location":"/resource/edit","status":"400","datetime":"2015-11-17T00:57:52.303Z"},{"date":"14/12/2015","time":"20:36:16","ip":"56.162.113.79","method":"PUT","location":"/first","status":"500","datetime":"2015-12-14T19:36:16.303Z"},{"date":"6/1/2016","time":"14:13:55","ip":"56.162.113.79","method":"DELETE","location":"/job/1","status":"204","datetime":"2016-01-06T13:13:55.303Z"},{"date":"13/1/2016","time":"0:32:4","ip":"56.162.113.79","method":"DELETE","location":"/job/3","status":"404","datetime":"2016-01-12T23:32:04.303Z"},{"date":"21/2/2016","time":"3:55:17","ip":"56.162.113.79","method":"POST","location":"/job/2/output","status":"403","datetime":"2016-02-21T02:55:17.303Z"},{"date":"11/3/2016","time":"9:58:6","ip":"56.162.113.79","method":"DELETE","location":"/other","status":"403","datetime":"2016-03-11T08:58:06.303Z"},{"date":"23/3/2016","time":"3:12:24","ip":"56.162.113.79","method":"POST","location":"/job","status":"401","datetime":"2016-03-23T02:12:24.303Z"},{"date":"7/5/2016","time":"14:34:48","ip":"56.162.113.79","method":"PUT","location":"/next","status":"500","datetime":"2016-05-07T12:34:48.303Z"},{"date":"21/9/2016","time":"0:58:28","ip":"56.162.113.79","method":"OPTIONS","location":"/job/2/output","status":"200","datetime":"2016-09-20T22:58:28.303Z"},{"date":"7/10/2016","time":"20:5:23","ip":"56.162.113.79","method":"DELETE","location":"/job/2","status":"500","datetime":"2016-10-07T18:05:23.303Z"},{"date":"19/10/2016","time":"1:19:44","ip":"56.162.113.79","method":"OPTIONS","location":"/next","status":"404","datetime":"2016-10-18T23:19:44.303Z"},{"date":"20/11/2016","time":"10:6:0","ip":"56.162.113.79","method":"OPTIONS","location":"/resource","status":"200","datetime":"2016-11-20T09:06:00.302Z"},{"date":"29/11/2016","time":"15:17:37","ip":"56.162.113.79","method":"GET","location":"/last","status":"303","datetime":"2016-11-29T14:17:37.303Z"},{"date":"16/12/2016","time":"23:2:49","ip":"56.162.113.79","method":"POST","location":"/job/2","status":"401","datetime":"2016-12-16T22:02:49.303Z"},{"date":"9/1/2017","time":"3:48:58","ip":"56.162.113.79","method":"OPTIONS","location":"/job/1/output","status":"200","datetime":"2017-01-09T02:48:58.303Z"},{"date":"17/2/2017","time":"23:58:46","ip":"56.162.113.79","method":"GET","location":"/prev","status":"301","datetime":"2017-02-17T22:58:46.303Z"},{"date":"4/3/2017","time":"13:22:31","ip":"56.162.113.79","method":"PUT","location":"/last","status":"201","datetime":"2017-03-04T12:22:31.303Z"},{"date":"7/3/2017","time":"7:39:3","ip":"56.162.113.79","method":"DELETE","location":"/job/1/output","status":"404","datetime":"2017-03-07T06:39:03.303Z"},{"date":"14/4/2017","time":"5:4:50","ip":"56.162.113.79","method":"OPTIONS","location":"/resource2","status":"200","datetime":"2017-04-14T03:04:50.303Z"},{"date":"3/5/2017","time":"22:42:32","ip":"56.162.113.79","method":"POST","location":"/job/2","status":"403","datetime":"2017-05-03T20:42:32.303Z"},{"date":"12/5/2017","time":"22:0:7","ip":"56.162.113.79","method":"GET","location":"/resource1","status":"307","datetime":"2017-05-12T20:00:07.303Z"},{"date":"1/6/2017","time":"19:42:51","ip":"56.162.113.79","method":"OPTIONS","location":"/other","status":"200","datetime":"2017-06-01T17:42:51.303Z"},{"date":"3/6/2017","time":"21:28:56","ip":"56.162.113.79","method":"OPTIONS","location":"/resource2","status":"404","datetime":"2017-06-03T19:28:56.303Z"},{"date":"5/6/2017","time":"23:4:23","ip":"56.162.113.79","method":"POST","location":"/resource2","status":"201","datetime":"2017-06-05T21:04:23.303Z"},{"date":"24/6/2017","time":"14:24:19","ip":"56.162.113.79","method":"OPTIONS","location":"/prev","status":"404","datetime":"2017-06-24T12:24:19.303Z"},{"date":"26/6/2017","time":"20:1:21","ip":"56.162.113.79","method":"DELETE","location":"/job/1/output","status":"401","datetime":"2017-06-26T18:01:21.303Z"},{"date":"16/8/2017","time":"13:41:13","ip":"56.162.113.79","method":"DELETE","location":"/job/2","status":"500","datetime":"2017-08-16T11:41:13.303Z"},{"date":"23/9/2017","time":"13:19:28","ip":"56.162.113.79","method":"DELETE","location":"/prev","status":"404","datetime":"2017-09-23T11:19:28.303Z"},{"date":"28/9/2017","time":"3:29:12","ip":"56.162.113.79","method":"GET","location":"/job/3","status":"404","datetime":"2017-09-28T01:29:12.303Z"},{"date":"28/9/2017","time":"21:9:31","ip":"56.162.113.79","method":"PUT","location":"/other","status":"403","datetime":"2017-09-28T19:09:31.303Z"},{"date":"3/10/2017","time":"1:52:50","ip":"56.162.113.79","method":"GET","location":"/job/2/output","status":"401","datetime":"2017-10-02T23:52:50.303Z"},{"date":"18/11/2017","time":"18:35:44","ip":"56.162.113.79","method":"GET","location":"/other","status":"301","datetime":"2017-11-18T17:35:44.303Z"},{"date":"1/12/2017","time":"8:39:22","ip":"56.162.113.79","method":"PUT","location":"/job/1/output","status":"401","datetime":"2017-12-01T07:39:22.303Z"},{"date":"22/1/2018","time":"18:6:16","ip":"56.162.113.79","method":"PUT","location":"/","status":"200","datetime":"2018-01-22T17:06:16.303Z"}],"204.20.48.194":[{"date":"13/3/2012","time":"6:43:13","ip":"204.20.48.194","method":"GET","location":"/job/2","status":"303","datetime":"2012-03-13T05:43:13.303Z"},{"date":"19/4/2012","time":"8:50:36","ip":"204.20.48.194","method":"PUT","location":"/job/3","status":"403","datetime":"2012-04-19T06:50:36.303Z"},{"date":"3/5/2012","time":"18:6:44","ip":"204.20.48.194","method":"GET","location":"/","status":"303","datetime":"2012-05-03T16:06:44.303Z"},{"date":"7/8/2012","time":"18:12:1","ip":"204.20.48.194","method":"POST","location":"/job/2/output","status":"405","datetime":"2012-08-07T16:12:01.303Z"},{"date":"18/8/2012","time":"0:14:54","ip":"204.20.48.194","method":"POST","location":"/","status":"500","datetime":"2012-08-17T22:14:54.303Z"},{"date":"10/9/2012","time":"19:42:15","ip":"204.20.48.194","method":"OPTIONS","location":"/last","status":"404","datetime":"2012-09-10T17:42:15.303Z"},{"date":"13/9/2012","time":"8:48:14","ip":"204.20.48.194","method":"POST","location":"/","status":"201","datetime":"2012-09-13T06:48:14.303Z"},{"date":"2/10/2012","time":"20:26:43","ip":"204.20.48.194","method":"PUT","location":"/job/2/output","status":"409","datetime":"2012-10-02T18:26:43.303Z"},{"date":"15/10/2012","time":"4:0:31","ip":"204.20.48.194","method":"OPTIONS","location":"/first","status":"200","datetime":"2012-10-15T02:00:31.303Z"},{"date":"13/11/2012","time":"4:45:0","ip":"204.20.48.194","method":"PUT","location":"/first","status":"403","datetime":"2012-11-13T03:45:00.303Z"},{"date":"2/12/2012","time":"4:29:29","ip":"204.20.48.194","method":"PUT","location":"/job/2/output","status":"405","datetime":"2012-12-02T03:29:29.303Z"},{"date":"10/12/2012","time":"18:8:59","ip":"204.20.48.194","method":"DELETE","location":"/job/1","status":"405","datetime":"2012-12-10T17:08:59.303Z"},{"date":"3/1/2013","time":"21:59:57","ip":"204.20.48.194","method":"DELETE","location":"/resource/edit","status":"403","datetime":"2013-01-03T20:59:57.303Z"},{"date":"12/1/2013","time":"11:58:49","ip":"204.20.48.194","method":"OPTIONS","location":"/next","status":"200","datetime":"2013-01-12T10:58:49.303Z"},{"date":"12/1/2013","time":"19:29:34","ip":"204.20.48.194","method":"POST","location":"/","status":"404","datetime":"2013-01-12T18:29:34.303Z"},{"date":"14/1/2013","time":"21:14:17","ip":"204.20.48.194","method":"OPTIONS","location":"/prev","status":"200","datetime":"2013-01-14T20:14:17.303Z"},{"date":"22/1/2013","time":"0:11:48","ip":"204.20.48.194","method":"GET","location":"/job/3","status":"308","datetime":"2013-01-21T23:11:48.303Z"},{"date":"22/2/2013","time":"23:52:23","ip":"204.20.48.194","method":"DELETE","location":"/resource1","status":"403","datetime":"2013-02-22T22:52:23.303Z"},{"date":"2/3/2013","time":"5:53:48","ip":"204.20.48.194","method":"GET","location":"/next","status":"404","datetime":"2013-03-02T04:53:48.303Z"},{"date":"30/3/2013","time":"5:35:16","ip":"204.20.48.194","method":"DELETE","location":"/last","status":"403","datetime":"2013-03-30T04:35:16.303Z"},{"date":"2/4/2013","time":"21:16:57","ip":"204.20.48.194","method":"POST","location":"/","status":"404","datetime":"2013-04-02T19:16:57.303Z"},{"date":"4/4/2013","time":"3:56:14","ip":"204.20.48.194","method":"DELETE","location":"/last","status":"403","datetime":"2013-04-04T01:56:14.303Z"},{"date":"11/4/2013","time":"4:1:44","ip":"204.20.48.194","method":"OPTIONS","location":"/last","status":"200","datetime":"2013-04-11T02:01:44.303Z"},{"date":"14/4/2013","time":"8:58:31","ip":"204.20.48.194","method":"OPTIONS","location":"/next","status":"200","datetime":"2013-04-14T06:58:31.303Z"},{"date":"25/7/2013","time":"8:46:49","ip":"204.20.48.194","method":"DELETE","location":"/job","status":"404","datetime":"2013-07-25T06:46:49.303Z"},{"date":"30/8/2013","time":"13:44:58","ip":"204.20.48.194","method":"PUT","location":"/resource","status":"200","datetime":"2013-08-30T11:44:58.303Z"},{"date":"12/9/2013","time":"11:9:17","ip":"204.20.48.194","method":"POST","location":"/next","status":"200","datetime":"2013-09-12T09:09:17.303Z"},{"date":"13/9/2013","time":"12:3:24","ip":"204.20.48.194","method":"POST","location":"/last","status":"201","datetime":"2013-09-13T10:03:24.303Z"},{"date":"15/10/2013","time":"11:22:57","ip":"204.20.48.194","method":"POST","location":"/prev","status":"500","datetime":"2013-10-15T09:22:57.303Z"},{"date":"5/11/2013","time":"15:25:21","ip":"204.20.48.194","method":"OPTIONS","location":"/job/2/output","status":"404","datetime":"2013-11-05T14:25:21.303Z"},{"date":"12/11/2013","time":"1:0:18","ip":"204.20.48.194","method":"DELETE","location":"/job","status":"400","datetime":"2013-11-12T00:00:18.303Z"},{"date":"8/12/2013","time":"12:11:25","ip":"204.20.48.194","method":"PUT","location":"/job/1/output","status":"403","datetime":"2013-12-08T11:11:25.303Z"},{"date":"9/12/2013","time":"13:22:24","ip":"204.20.48.194","method":"DELETE","location":"/job/3","status":"400","datetime":"2013-12-09T12:22:24.303Z"},{"date":"31/12/2013","time":"18:3:41","ip":"204.20.48.194","method":"POST","location":"/last","status":"403","datetime":"2013-12-31T17:03:41.303Z"},{"date":"13/2/2014","time":"10:46:51","ip":"204.20.48.194","method":"PUT","location":"/resource","status":"403","datetime":"2014-02-13T09:46:51.303Z"},{"date":"17/2/2014","time":"1:32:15","ip":"204.20.48.194","method":"GET","location":"/job/1/output","status":"303","datetime":"2014-02-17T00:32:15.303Z"},{"date":"26/2/2014","time":"20:44:9","ip":"204.20.48.194","method":"GET","location":"/job/1","status":"303","datetime":"2014-02-26T19:44:09.303Z"},{"date":"12/3/2014","time":"18:26:19","ip":"204.20.48.194","method":"OPTIONS","location":"/job/3","status":"404","datetime":"2014-03-12T17:26:19.303Z"},{"date":"24/3/2014","time":"18:4:53","ip":"204.20.48.194","method":"GET","location":"/job/2/output","status":"401","datetime":"2014-03-24T17:04:53.303Z"},{"date":"3/4/2014","time":"3:17:22","ip":"204.20.48.194","method":"OPTIONS","location":"/resource","status":"404","datetime":"2014-04-03T01:17:22.303Z"},{"date":"1/7/2014","time":"5:43:56","ip":"204.20.48.194","method":"POST","location":"/resource/edit","status":"200","datetime":"2014-07-01T03:43:56.303Z"},{"date":"17/7/2014","time":"16:49:40","ip":"204.20.48.194","method":"POST","location":"/resource","status":"404","datetime":"2014-07-17T14:49:40.303Z"},{"date":"20/8/2014","time":"13:34:7","ip":"204.20.48.194","method":"POST","location":"/job/3","status":"401","datetime":"2014-08-20T11:34:07.303Z"},{"date":"2/9/2014","time":"5:12:6","ip":"204.20.48.194","method":"GET","location":"/job","status":"403","datetime":"2014-09-02T03:12:06.303Z"},{"date":"25/9/2014","time":"17:4:37","ip":"204.20.48.194","method":"GET","location":"/resource","status":"200","datetime":"2014-09-25T15:04:37.303Z"},{"date":"28/9/2014","time":"22:3:36","ip":"204.20.48.194","method":"GET","location":"/job/2","status":"303","datetime":"2014-09-28T20:03:36.303Z"},{"date":"9/10/2014","time":"5:29:50","ip":"204.20.48.194","method":"PUT","location":"/job/1","status":"403","datetime":"2014-10-09T03:29:50.303Z"},{"date":"7/12/2014","time":"19:49:9","ip":"204.20.48.194","method":"POST","location":"/job/3","status":"200","datetime":"2014-12-07T18:49:09.303Z"},{"date":"17/12/2014","time":"10:7:23","ip":"204.20.48.194","method":"PUT","location":"/resource","status":"403","datetime":"2014-12-17T09:07:23.303Z"},{"date":"15/1/2015","time":"11:37:15","ip":"204.20.48.194","method":"OPTIONS","location":"/job/3","status":"200","datetime":"2015-01-15T10:37:15.303Z"},{"date":"23/1/2015","time":"5:5:37","ip":"204.20.48.194","method":"PUT","location":"/job/3","status":"200","datetime":"2015-01-23T04:05:37.303Z"},{"date":"3/3/2015","time":"6:59:6","ip":"204.20.48.194","method":"POST","location":"/job/3","status":"405","datetime":"2015-03-03T05:59:06.303Z"},{"date":"26/3/2015","time":"4:0:33","ip":"204.20.48.194","method":"PUT","location":"/first","status":"405","datetime":"2015-03-26T03:00:33.303Z"},{"date":"19/4/2015","time":"6:40:38","ip":"204.20.48.194","method":"OPTIONS","location":"/job/1","status":"404","datetime":"2015-04-19T04:40:38.303Z"},{"date":"24/5/2015","time":"19:50:27","ip":"204.20.48.194","method":"GET","location":"/other","status":"401","datetime":"2015-05-24T17:50:27.303Z"},{"date":"2/6/2015","time":"21:19:29","ip":"204.20.48.194","method":"PUT","location":"/job/2/output","status":"200","datetime":"2015-06-02T19:19:29.303Z"},{"date":"4/7/2015","time":"5:37:36","ip":"204.20.48.194","method":"PUT","location":"/","status":"403","datetime":"2015-07-04T03:37:36.303Z"},{"date":"31/8/2015","time":"9:25:29","ip":"204.20.48.194","method":"DELETE","location":"/resource","status":"400","datetime":"2015-08-31T07:25:29.303Z"},{"date":"10/9/2015","time":"11:17:34","ip":"204.20.48.194","method":"GET","location":"/","status":"200","datetime":"2015-09-10T09:17:34.303Z"},{"date":"6/10/2015","time":"14:50:45","ip":"204.20.48.194","method":"DELETE","location":"/resource/edit","status":"204","datetime":"2015-10-06T12:50:45.303Z"},{"date":"25/10/2015","time":"2:23:15","ip":"204.20.48.194","method":"GET","location":"/job/1","status":"301","datetime":"2015-10-25T00:23:15.303Z"},{"date":"28/11/2015","time":"23:25:27","ip":"204.20.48.194","method":"POST","location":"/resource/edit","status":"201","datetime":"2015-11-28T22:25:27.303Z"},{"date":"14/1/2016","time":"13:8:5","ip":"204.20.48.194","method":"OPTIONS","location":"/job","status":"404","datetime":"2016-01-14T12:08:05.303Z"},{"date":"2/2/2016","time":"1:16:7","ip":"204.20.48.194","method":"DELETE","location":"/last","status":"500","datetime":"2016-02-02T00:16:07.303Z"},{"date":"2/2/2016","time":"5:34:13","ip":"204.20.48.194","method":"PUT","location":"/prev","status":"500","datetime":"2016-02-02T04:34:13.303Z"},{"date":"19/2/2016","time":"12:36:40","ip":"204.20.48.194","method":"POST","location":"/job/3","status":"201","datetime":"2016-02-19T11:36:40.303Z"},{"date":"5/3/2016","time":"4:8:38","ip":"204.20.48.194","method":"GET","location":"/job/1","status":"401","datetime":"2016-03-05T03:08:38.303Z"},{"date":"15/3/2016","time":"18:15:30","ip":"204.20.48.194","method":"DELETE","location":"/last","status":"404","datetime":"2016-03-15T17:15:30.303Z"},{"date":"25/3/2016","time":"19:34:54","ip":"204.20.48.194","method":"OPTIONS","location":"/job","status":"404","datetime":"2016-03-25T18:34:54.303Z"},{"date":"28/3/2016","time":"20:20:29","ip":"204.20.48.194","method":"PUT","location":"/job/3","status":"400","datetime":"2016-03-28T18:20:29.303Z"},{"date":"29/3/2016","time":"23:11:24","ip":"204.20.48.194","method":"DELETE","location":"/other","status":"405","datetime":"2016-03-29T21:11:24.303Z"},{"date":"27/6/2016","time":"20:43:3","ip":"204.20.48.194","method":"DELETE","location":"/job/3","status":"204","datetime":"2016-06-27T18:43:03.303Z"},{"date":"30/9/2016","time":"0:9:14","ip":"204.20.48.194","method":"PUT","location":"/resource","status":"405","datetime":"2016-09-29T22:09:14.303Z"},{"date":"12/11/2016","time":"2:42:40","ip":"204.20.48.194","method":"PUT","location":"/job/3","status":"400","datetime":"2016-11-12T01:42:40.303Z"},{"date":"28/11/2016","time":"11:19:54","ip":"204.20.48.194","method":"GET","location":"/","status":"403","datetime":"2016-11-28T10:19:54.303Z"},{"date":"29/11/2016","time":"8:45:54","ip":"204.20.48.194","method":"PUT","location":"/resource","status":"500","datetime":"2016-11-29T07:45:54.303Z"},{"date":"29/12/2016","time":"14:3:15","ip":"204.20.48.194","method":"OPTIONS","location":"/prev","status":"200","datetime":"2016-12-29T13:03:15.303Z"},{"date":"27/1/2017","time":"17:16:19","ip":"204.20.48.194","method":"POST","location":"/last","status":"400","datetime":"2017-01-27T16:16:19.303Z"},{"date":"28/3/2017","time":"11:32:50","ip":"204.20.48.194","method":"PUT","location":"/resource1","status":"201","datetime":"2017-03-28T09:32:50.303Z"},{"date":"14/4/2017","time":"18:0:39","ip":"204.20.48.194","method":"PUT","location":"/job/1","status":"405","datetime":"2017-04-14T16:00:39.303Z"},{"date":"16/5/2017","time":"10:36:27","ip":"204.20.48.194","method":"POST","location":"/job/2","status":"404","datetime":"2017-05-16T08:36:27.303Z"},{"date":"19/5/2017","time":"16:58:46","ip":"204.20.48.194","method":"DELETE","location":"/job/1/output","status":"405","datetime":"2017-05-19T14:58:46.303Z"},{"date":"22/5/2017","time":"20:44:43","ip":"204.20.48.194","method":"PUT","location":"/resource2","status":"201","datetime":"2017-05-22T18:44:43.303Z"},{"date":"25/7/2017","time":"9:29:24","ip":"204.20.48.194","method":"DELETE","location":"/next","status":"204","datetime":"2017-07-25T07:29:24.303Z"},{"date":"9/8/2017","time":"6:0:47","ip":"204.20.48.194","method":"OPTIONS","location":"/resource2","status":"404","datetime":"2017-08-09T04:00:47.303Z"},{"date":"13/8/2017","time":"20:26:47","ip":"204.20.48.194","method":"POST","location":"/resource/edit","status":"405","datetime":"2017-08-13T18:26:47.303Z"},{"date":"29/8/2017","time":"8:48:38","ip":"204.20.48.194","method":"POST","location":"/last","status":"200","datetime":"2017-08-29T06:48:38.303Z"},{"date":"18/9/2017","time":"9:26:15","ip":"204.20.48.194","method":"GET","location":"/resource","status":"308","datetime":"2017-09-18T07:26:15.303Z"},{"date":"5/10/2017","time":"1:3:59","ip":"204.20.48.194","method":"OPTIONS","location":"/last","status":"200","datetime":"2017-10-04T23:03:59.303Z"},{"date":"27/10/2017","time":"5:50:19","ip":"204.20.48.194","method":"PUT","location":"/job","status":"403","datetime":"2017-10-27T03:50:19.303Z"},{"date":"31/10/2017","time":"12:58:33","ip":"204.20.48.194","method":"GET","location":"/job/1","status":"500","datetime":"2017-10-31T11:58:33.303Z"},{"date":"31/10/2017","time":"22:3:58","ip":"204.20.48.194","method":"PUT","location":"/job/3","status":"500","datetime":"2017-10-31T21:03:58.303Z"},{"date":"1/3/2018","time":"3:3:51","ip":"204.20.48.194","method":"POST","location":"/next","status":"500","datetime":"2018-03-01T02:03:51.303Z"}],"144.55.236.141":[{"date":"14/1/2012","time":"7:14:3","ip":"144.55.236.141","method":"OPTIONS","location":"/job","status":"200","datetime":"2012-01-14T06:14:03.303Z"},{"date":"15/1/2012","time":"21:1:21","ip":"144.55.236.141","method":"GET","location":"/resource/edit","status":"404","datetime":"2012-01-15T20:01:21.303Z"},{"date":"10/2/2012","time":"11:42:48","ip":"144.55.236.141","method":"DELETE","location":"/prev","status":"405","datetime":"2012-02-10T10:42:48.303Z"},{"date":"24/2/2012","time":"17:49:56","ip":"144.55.236.141","method":"OPTIONS","location":"/resource2","status":"200","datetime":"2012-02-24T16:49:56.303Z"},{"date":"25/2/2012","time":"10:34:24","ip":"144.55.236.141","method":"GET","location":"/job/2","status":"403","datetime":"2012-02-25T09:34:24.303Z"},{"date":"27/3/2012","time":"10:4:24","ip":"144.55.236.141","method":"DELETE","location":"/job","status":"405","datetime":"2012-03-27T08:04:24.303Z"},{"date":"7/4/2012","time":"0:19:51","ip":"144.55.236.141","method":"PUT","location":"/resource","status":"409","datetime":"2012-04-06T22:19:51.303Z"},{"date":"11/4/2012","time":"15:37:6","ip":"144.55.236.141","method":"GET","location":"/job/1/output","status":"403","datetime":"2012-04-11T13:37:06.303Z"},{"date":"26/6/2012","time":"4:7:29","ip":"144.55.236.141","method":"POST","location":"/resource2","status":"200","datetime":"2012-06-26T02:07:29.303Z"},{"date":"28/6/2012","time":"11:49:32","ip":"144.55.236.141","method":"GET","location":"/resource1","status":"303","datetime":"2012-06-28T09:49:32.303Z"},{"date":"11/9/2012","time":"3:35:44","ip":"144.55.236.141","method":"PUT","location":"/other","status":"201","datetime":"2012-09-11T01:35:44.303Z"},{"date":"12/9/2012","time":"18:12:52","ip":"144.55.236.141","method":"GET","location":"/first","status":"301","datetime":"2012-09-12T16:12:52.303Z"},{"date":"15/10/2012","time":"17:9:26","ip":"144.55.236.141","method":"GET","location":"/","status":"200","datetime":"2012-10-15T15:09:26.303Z"},{"date":"26/11/2012","time":"18:14:10","ip":"144.55.236.141","method":"PUT","location":"/job","status":"201","datetime":"2012-11-26T17:14:10.303Z"},{"date":"19/12/2012","time":"17:10:57","ip":"144.55.236.141","method":"PUT","location":"/resource1","status":"500","datetime":"2012-12-19T16:10:57.303Z"},{"date":"31/12/2012","time":"6:20:53","ip":"144.55.236.141","method":"GET","location":"/job/1/output","status":"301","datetime":"2012-12-31T05:20:53.303Z"},{"date":"10/1/2013","time":"11:45:6","ip":"144.55.236.141","method":"POST","location":"/resource1","status":"200","datetime":"2013-01-10T10:45:06.303Z"},{"date":"17/2/2013","time":"22:10:3","ip":"144.55.236.141","method":"OPTIONS","location":"/other","status":"404","datetime":"2013-02-17T21:10:03.303Z"},{"date":"7/3/2013","time":"9:57:40","ip":"144.55.236.141","method":"DELETE","location":"/job","status":"400","datetime":"2013-03-07T08:57:40.303Z"},{"date":"1/4/2013","time":"2:32:25","ip":"144.55.236.141","method":"DELETE","location":"/job/2/output","status":"404","datetime":"2013-04-01T00:32:25.303Z"},{"date":"23/4/2013","time":"10:8:32","ip":"144.55.236.141","method":"GET","location":"/job/1","status":"500","datetime":"2013-04-23T08:08:32.303Z"},{"date":"7/7/2013","time":"11:31:49","ip":"144.55.236.141","method":"OPTIONS","location":"/other","status":"200","datetime":"2013-07-07T09:31:49.303Z"},{"date":"9/7/2013","time":"23:29:29","ip":"144.55.236.141","method":"POST","location":"/job/3","status":"200","datetime":"2013-07-09T21:29:29.303Z"},{"date":"14/7/2013","time":"19:56:29","ip":"144.55.236.141","method":"DELETE","location":"/job/2/output","status":"401","datetime":"2013-07-14T17:56:29.303Z"},{"date":"26/7/2013","time":"13:27:57","ip":"144.55.236.141","method":"GET","location":"/job/2/output","status":"200","datetime":"2013-07-26T11:27:57.303Z"},{"date":"3/10/2013","time":"3:3:52","ip":"144.55.236.141","method":"OPTIONS","location":"/job/1","status":"200","datetime":"2013-10-03T01:03:52.303Z"},{"date":"15/10/2013","time":"9:44:35","ip":"144.55.236.141","method":"OPTIONS","location":"/resource/edit","status":"404","datetime":"2013-10-15T07:44:35.303Z"},{"date":"1/1/2014","time":"10:6:5","ip":"144.55.236.141","method":"POST","location":"/resource2","status":"401","datetime":"2014-01-01T09:06:05.303Z"},{"date":"23/1/2014","time":"10:25:57","ip":"144.55.236.141","method":"POST","location":"/other","status":"400","datetime":"2014-01-23T09:25:57.303Z"},{"date":"14/2/2014","time":"12:28:10","ip":"144.55.236.141","method":"GET","location":"/job/1/output","status":"303","datetime":"2014-02-14T11:28:10.303Z"},{"date":"18/2/2014","time":"23:8:24","ip":"144.55.236.141","method":"GET","location":"/job/1","status":"403","datetime":"2014-02-18T22:08:24.303Z"},{"date":"22/2/2014","time":"0:49:46","ip":"144.55.236.141","method":"POST","location":"/prev","status":"405","datetime":"2014-02-21T23:49:46.303Z"},{"date":"4/3/2014","time":"3:31:48","ip":"144.55.236.141","method":"OPTIONS","location":"/next","status":"404","datetime":"2014-03-04T02:31:48.303Z"},{"date":"16/4/2014","time":"0:55:55","ip":"144.55.236.141","method":"PUT","location":"/next","status":"409","datetime":"2014-04-15T22:55:55.303Z"},{"date":"26/5/2014","time":"20:47:37","ip":"144.55.236.141","method":"OPTIONS","location":"/job","status":"404","datetime":"2014-05-26T18:47:37.303Z"},{"date":"3/6/2014","time":"15:27:15","ip":"144.55.236.141","method":"GET","location":"/resource2","status":"308","datetime":"2014-06-03T13:27:15.303Z"},{"date":"18/7/2014","time":"12:14:54","ip":"144.55.236.141","method":"DELETE","location":"/other","status":"204","datetime":"2014-07-18T10:14:54.303Z"},{"date":"22/7/2014","time":"8:13:17","ip":"144.55.236.141","method":"DELETE","location":"/job/1/output","status":"403","datetime":"2014-07-22T06:13:17.303Z"},{"date":"3/8/2014","time":"13:33:11","ip":"144.55.236.141","method":"PUT","location":"/first","status":"200","datetime":"2014-08-03T11:33:11.303Z"},{"date":"22/8/2014","time":"6:17:35","ip":"144.55.236.141","method":"POST","location":"/other","status":"201","datetime":"2014-08-22T04:17:35.303Z"},{"date":"2/9/2014","time":"13:3:5","ip":"144.55.236.141","method":"DELETE","location":"/resource","status":"405","datetime":"2014-09-02T11:03:05.303Z"},{"date":"12/11/2014","time":"4:17:50","ip":"144.55.236.141","method":"DELETE","location":"/first","status":"405","datetime":"2014-11-12T03:17:50.303Z"},{"date":"14/12/2014","time":"10:52:25","ip":"144.55.236.141","method":"DELETE","location":"/first","status":"403","datetime":"2014-12-14T09:52:25.303Z"},{"date":"4/1/2015","time":"12:6:8","ip":"144.55.236.141","method":"POST","location":"/resource2","status":"500","datetime":"2015-01-04T11:06:08.303Z"},{"date":"5/1/2015","time":"11:29:10","ip":"144.55.236.141","method":"POST","location":"/resource","status":"201","datetime":"2015-01-05T10:29:10.303Z"},{"date":"7/3/2015","time":"5:10:39","ip":"144.55.236.141","method":"OPTIONS","location":"/resource/edit","status":"404","datetime":"2015-03-07T04:10:39.303Z"},{"date":"4/5/2015","time":"16:0:19","ip":"144.55.236.141","method":"POST","location":"/prev","status":"200","datetime":"2015-05-04T14:00:19.303Z"},{"date":"8/5/2015","time":"5:20:32","ip":"144.55.236.141","method":"PUT","location":"/last","status":"400","datetime":"2015-05-08T03:20:32.303Z"},{"date":"21/5/2015","time":"12:55:15","ip":"144.55.236.141","method":"POST","location":"/job/3","status":"403","datetime":"2015-05-21T10:55:15.303Z"},{"date":"27/5/2015","time":"16:8:16","ip":"144.55.236.141","method":"POST","location":"/job","status":"401","datetime":"2015-05-27T14:08:16.303Z"},{"date":"17/7/2015","time":"1:58:15","ip":"144.55.236.141","method":"PUT","location":"/last","status":"403","datetime":"2015-07-16T23:58:15.303Z"},{"date":"21/7/2015","time":"5:25:54","ip":"144.55.236.141","method":"POST","location":"/resource1","status":"405","datetime":"2015-07-21T03:25:54.303Z"},{"date":"25/7/2015","time":"8:5:37","ip":"144.55.236.141","method":"POST","location":"/resource1","status":"405","datetime":"2015-07-25T06:05:37.303Z"},{"date":"4/11/2015","time":"16:26:9","ip":"144.55.236.141","method":"DELETE","location":"/","status":"204","datetime":"2015-11-04T15:26:09.303Z"},{"date":"12/12/2015","time":"12:14:13","ip":"144.55.236.141","method":"DELETE","location":"/resource","status":"400","datetime":"2015-12-12T11:14:13.303Z"},{"date":"19/12/2015","time":"9:28:53","ip":"144.55.236.141","method":"POST","location":"/job","status":"202","datetime":"2015-12-19T08:28:53.303Z"},{"date":"11/1/2016","time":"9:13:40","ip":"144.55.236.141","method":"GET","location":"/","status":"404","datetime":"2016-01-11T08:13:40.303Z"},{"date":"11/2/2016","time":"0:4:30","ip":"144.55.236.141","method":"POST","location":"/job","status":"200","datetime":"2016-02-10T23:04:30.303Z"},{"date":"22/2/2016","time":"5:22:26","ip":"144.55.236.141","method":"POST","location":"/resource","status":"201","datetime":"2016-02-22T04:22:26.303Z"},{"date":"2/3/2016","time":"9:47:29","ip":"144.55.236.141","method":"DELETE","location":"/last","status":"405","datetime":"2016-03-02T08:47:29.303Z"},{"date":"1/4/2016","time":"14:3:19","ip":"144.55.236.141","method":"OPTIONS","location":"/job/1/output","status":"404","datetime":"2016-04-01T12:03:19.303Z"},{"date":"8/4/2016","time":"17:28:51","ip":"144.55.236.141","method":"GET","location":"/job/1","status":"307","datetime":"2016-04-08T15:28:51.303Z"},{"date":"21/4/2016","time":"22:41:7","ip":"144.55.236.141","method":"OPTIONS","location":"/job/3","status":"404","datetime":"2016-04-21T20:41:07.303Z"},{"date":"27/4/2016","time":"6:47:14","ip":"144.55.236.141","method":"PUT","location":"/resource","status":"401","datetime":"2016-04-27T04:47:14.303Z"},{"date":"22/5/2016","time":"4:55:12","ip":"144.55.236.141","method":"POST","location":"/job","status":"405","datetime":"2016-05-22T02:55:12.303Z"},{"date":"29/5/2016","time":"5:3:43","ip":"144.55.236.141","method":"GET","location":"/last","status":"403","datetime":"2016-05-29T03:03:43.303Z"},{"date":"28/6/2016","time":"2:8:24","ip":"144.55.236.141","method":"OPTIONS","location":"/job/1/output","status":"404","datetime":"2016-06-28T00:08:24.303Z"},{"date":"17/8/2016","time":"9:35:39","ip":"144.55.236.141","method":"PUT","location":"/next","status":"405","datetime":"2016-08-17T07:35:39.303Z"},{"date":"24/8/2016","time":"0:39:40","ip":"144.55.236.141","method":"GET","location":"/prev","status":"404","datetime":"2016-08-23T22:39:40.303Z"},{"date":"16/9/2016","time":"21:47:15","ip":"144.55.236.141","method":"PUT","location":"/job/2","status":"400","datetime":"2016-09-16T19:47:15.303Z"},{"date":"20/10/2016","time":"13:11:5","ip":"144.55.236.141","method":"OPTIONS","location":"/","status":"200","datetime":"2016-10-20T11:11:05.303Z"},{"date":"1/11/2016","time":"7:45:2","ip":"144.55.236.141","method":"DELETE","location":"/prev","status":"405","datetime":"2016-11-01T06:45:02.303Z"},{"date":"8/11/2016","time":"16:27:56","ip":"144.55.236.141","method":"POST","location":"/resource1","status":"405","datetime":"2016-11-08T15:27:56.303Z"},{"date":"23/12/2016","time":"22:19:59","ip":"144.55.236.141","method":"POST","location":"/","status":"403","datetime":"2016-12-23T21:19:59.303Z"},{"date":"7/1/2017","time":"12:50:11","ip":"144.55.236.141","method":"PUT","location":"/other","status":"201","datetime":"2017-01-07T11:50:11.303Z"},{"date":"18/1/2017","time":"2:26:27","ip":"144.55.236.141","method":"PUT","location":"/resource","status":"200","datetime":"2017-01-18T01:26:27.303Z"},{"date":"18/1/2017","time":"17:39:29","ip":"144.55.236.141","method":"GET","location":"/resource","status":"303","datetime":"2017-01-18T16:39:29.303Z"},{"date":"27/3/2017","time":"8:35:45","ip":"144.55.236.141","method":"DELETE","location":"/prev","status":"204","datetime":"2017-03-27T06:35:45.303Z"},{"date":"14/4/2017","time":"4:28:53","ip":"144.55.236.141","method":"GET","location":"/resource2","status":"200","datetime":"2017-04-14T02:28:53.303Z"},{"date":"14/5/2017","time":"7:19:25","ip":"144.55.236.141","method":"PUT","location":"/resource/edit","status":"201","datetime":"2017-05-14T05:19:25.303Z"},{"date":"21/5/2017","time":"6:32:48","ip":"144.55.236.141","method":"POST","location":"/prev","status":"404","datetime":"2017-05-21T04:32:48.303Z"},{"date":"27/5/2017","time":"2:16:42","ip":"144.55.236.141","method":"OPTIONS","location":"/other","status":"404","datetime":"2017-05-27T00:16:42.303Z"},{"date":"7/6/2017","time":"20:6:7","ip":"144.55.236.141","method":"OPTIONS","location":"/next","status":"404","datetime":"2017-06-07T18:06:07.303Z"},{"date":"18/6/2017","time":"8:4:43","ip":"144.55.236.141","method":"OPTIONS","location":"/","status":"404","datetime":"2017-06-18T06:04:43.303Z"},{"date":"29/6/2017","time":"7:8:24","ip":"144.55.236.141","method":"OPTIONS","location":"/prev","status":"404","datetime":"2017-06-29T05:08:24.303Z"},{"date":"20/9/2017","time":"14:49:33","ip":"144.55.236.141","method":"DELETE","location":"/","status":"400","datetime":"2017-09-20T12:49:33.303Z"},{"date":"6/1/2018","time":"3:7:3","ip":"144.55.236.141","method":"POST","location":"/job/1","status":"201","datetime":"2018-01-06T02:07:03.303Z"},{"date":"14/1/2018","time":"13:55:53","ip":"144.55.236.141","method":"OPTIONS","location":"/resource1","status":"404","datetime":"2018-01-14T12:55:53.303Z"},{"date":"25/1/2018","time":"8:46:16","ip":"144.55.236.141","method":"POST","location":"/resource","status":"500","datetime":"2018-01-25T07:46:16.303Z"},{"date":"16/2/2018","time":"12:13:39","ip":"144.55.236.141","method":"DELETE","location":"/last","status":"404","datetime":"2018-02-16T11:13:39.303Z"}],"3.171.112.202":[{"date":"9/2/2012","time":"15:42:34","ip":"3.171.112.202","method":"POST","location":"/job/2/output","status":"404","datetime":"2012-02-09T14:42:34.303Z"},{"date":"6/3/2012","time":"7:18:45","ip":"3.171.112.202","method":"DELETE","location":"/job/3","status":"401","datetime":"2012-03-06T06:18:45.303Z"},{"date":"30/4/2012","time":"18:20:45","ip":"3.171.112.202","method":"OPTIONS","location":"/job/3","status":"404","datetime":"2012-04-30T16:20:45.303Z"},{"date":"20/6/2012","time":"3:7:5","ip":"3.171.112.202","method":"POST","location":"/resource1","status":"500","datetime":"2012-06-20T01:07:05.303Z"},{"date":"5/7/2012","time":"4:19:10","ip":"3.171.112.202","method":"PUT","location":"/other","status":"400","datetime":"2012-07-05T02:19:10.303Z"},{"date":"8/8/2012","time":"19:5:5","ip":"3.171.112.202","method":"PUT","location":"/other","status":"200","datetime":"2012-08-08T17:05:05.303Z"},{"date":"30/8/2012","time":"3:18:45","ip":"3.171.112.202","method":"GET","location":"/prev","status":"308","datetime":"2012-08-30T01:18:45.303Z"},{"date":"4/11/2012","time":"14:41:48","ip":"3.171.112.202","method":"DELETE","location":"/resource2","status":"204","datetime":"2012-11-04T13:41:48.303Z"},{"date":"8/11/2012","time":"16:39:43","ip":"3.171.112.202","method":"GET","location":"/job","status":"401","datetime":"2012-11-08T15:39:43.303Z"},{"date":"11/11/2012","time":"4:47:31","ip":"3.171.112.202","method":"OPTIONS","location":"/next","status":"404","datetime":"2012-11-11T03:47:31.303Z"},{"date":"12/11/2012","time":"21:25:3","ip":"3.171.112.202","method":"OPTIONS","location":"/job","status":"200","datetime":"2012-11-12T20:25:03.303Z"},{"date":"21/11/2012","time":"6:52:47","ip":"3.171.112.202","method":"OPTIONS","location":"/job/3","status":"404","datetime":"2012-11-21T05:52:47.303Z"},{"date":"2/12/2012","time":"11:51:25","ip":"3.171.112.202","method":"POST","location":"/next","status":"403","datetime":"2012-12-02T10:51:25.303Z"},{"date":"21/12/2012","time":"4:17:10","ip":"3.171.112.202","method":"DELETE","location":"/job/1/output","status":"400","datetime":"2012-12-21T03:17:10.303Z"},{"date":"29/12/2012","time":"19:16:11","ip":"3.171.112.202","method":"PUT","location":"/resource","status":"500","datetime":"2012-12-29T18:16:11.303Z"},{"date":"23/1/2013","time":"20:8:37","ip":"3.171.112.202","method":"POST","location":"/","status":"500","datetime":"2013-01-23T19:08:37.303Z"},{"date":"22/2/2013","time":"9:12:10","ip":"3.171.112.202","method":"DELETE","location":"/prev","status":"404","datetime":"2013-02-22T08:12:10.303Z"},{"date":"25/2/2013","time":"0:8:25","ip":"3.171.112.202","method":"PUT","location":"/job/2","status":"200","datetime":"2013-02-24T23:08:25.303Z"},{"date":"1/3/2013","time":"16:25:0","ip":"3.171.112.202","method":"POST","location":"/last","status":"202","datetime":"2013-03-01T15:25:00.303Z"},{"date":"31/5/2013","time":"22:1:19","ip":"3.171.112.202","method":"GET","location":"/job","status":"403","datetime":"2013-05-31T20:01:19.303Z"},{"date":"3/6/2013","time":"1:4:22","ip":"3.171.112.202","method":"POST","location":"/job/1","status":"403","datetime":"2013-06-02T23:04:22.303Z"},{"date":"10/6/2013","time":"14:55:31","ip":"3.171.112.202","method":"GET","location":"/next","status":"308","datetime":"2013-06-10T12:55:31.303Z"},{"date":"11/7/2013","time":"2:47:52","ip":"3.171.112.202","method":"OPTIONS","location":"/job/3","status":"404","datetime":"2013-07-11T00:47:52.303Z"},{"date":"18/7/2013","time":"6:15:15","ip":"3.171.112.202","method":"POST","location":"/job/1","status":"401","datetime":"2013-07-18T04:15:15.303Z"},{"date":"3/8/2013","time":"4:59:16","ip":"3.171.112.202","method":"PUT","location":"/job","status":"200","datetime":"2013-08-03T02:59:16.303Z"},{"date":"29/8/2013","time":"21:31:42","ip":"3.171.112.202","method":"OPTIONS","location":"/resource2","status":"404","datetime":"2013-08-29T19:31:42.303Z"},{"date":"10/9/2013","time":"0:52:40","ip":"3.171.112.202","method":"GET","location":"/first","status":"401","datetime":"2013-09-09T22:52:40.303Z"},{"date":"29/9/2013","time":"5:8:33","ip":"3.171.112.202","method":"OPTIONS","location":"/job","status":"404","datetime":"2013-09-29T03:08:33.303Z"},{"date":"15/10/2013","time":"9:9:7","ip":"3.171.112.202","method":"OPTIONS","location":"/resource/edit","status":"200","datetime":"2013-10-15T07:09:07.303Z"},{"date":"13/11/2013","time":"12:20:47","ip":"3.171.112.202","method":"OPTIONS","location":"/","status":"404","datetime":"2013-11-13T11:20:47.303Z"},{"date":"19/11/2013","time":"20:15:26","ip":"3.171.112.202","method":"PUT","location":"/resource2","status":"400","datetime":"2013-11-19T19:15:26.303Z"},{"date":"24/11/2013","time":"16:19:12","ip":"3.171.112.202","method":"OPTIONS","location":"/last","status":"200","datetime":"2013-11-24T15:19:12.303Z"},{"date":"10/1/2014","time":"13:28:24","ip":"3.171.112.202","method":"GET","location":"/job/2","status":"500","datetime":"2014-01-10T12:28:24.303Z"},{"date":"23/2/2014","time":"4:11:19","ip":"3.171.112.202","method":"PUT","location":"/","status":"500","datetime":"2014-02-23T03:11:19.303Z"},{"date":"6/3/2014","time":"10:39:3","ip":"3.171.112.202","method":"DELETE","location":"/job/3","status":"403","datetime":"2014-03-06T09:39:03.303Z"},{"date":"20/3/2014","time":"3:26:38","ip":"3.171.112.202","method":"GET","location":"/resource2","status":"301","datetime":"2014-03-20T02:26:38.303Z"},{"date":"1/6/2014","time":"23:8:57","ip":"3.171.112.202","method":"OPTIONS","location":"/prev","status":"200","datetime":"2014-06-01T21:08:57.303Z"},{"date":"7/6/2014","time":"8:17:31","ip":"3.171.112.202","method":"PUT","location":"/","status":"500","datetime":"2014-06-07T06:17:31.303Z"},{"date":"7/6/2014","time":"15:31:59","ip":"3.171.112.202","method":"GET","location":"/resource/edit","status":"500","datetime":"2014-06-07T13:31:59.303Z"},{"date":"8/6/2014","time":"2:38:27","ip":"3.171.112.202","method":"GET","location":"/prev","status":"403","datetime":"2014-06-08T00:38:27.303Z"},{"date":"25/6/2014","time":"2:54:32","ip":"3.171.112.202","method":"PUT","location":"/next","status":"201","datetime":"2014-06-25T00:54:32.303Z"},{"date":"28/6/2014","time":"5:8:51","ip":"3.171.112.202","method":"POST","location":"/job/3","status":"400","datetime":"2014-06-28T03:08:51.303Z"},{"date":"13/7/2014","time":"9:30:20","ip":"3.171.112.202","method":"DELETE","location":"/last","status":"401","datetime":"2014-07-13T07:30:20.303Z"},{"date":"4/8/2014","time":"5:11:13","ip":"3.171.112.202","method":"DELETE","location":"/job/3","status":"405","datetime":"2014-08-04T03:11:13.303Z"},{"date":"5/8/2014","time":"12:51:49","ip":"3.171.112.202","method":"POST","location":"/next","status":"401","datetime":"2014-08-05T10:51:49.303Z"},{"date":"25/8/2014","time":"20:50:12","ip":"3.171.112.202","method":"OPTIONS","location":"/resource2","status":"404","datetime":"2014-08-25T18:50:12.303Z"},{"date":"3/9/2014","time":"11:21:15","ip":"3.171.112.202","method":"GET","location":"/job/3","status":"403","datetime":"2014-09-03T09:21:15.303Z"},{"date":"18/9/2014","time":"13:20:54","ip":"3.171.112.202","method":"GET","location":"/job/1","status":"404","datetime":"2014-09-18T11:20:54.303Z"},{"date":"22/9/2014","time":"9:10:32","ip":"3.171.112.202","method":"DELETE","location":"/job","status":"403","datetime":"2014-09-22T07:10:32.303Z"},{"date":"21/10/2014","time":"22:25:7","ip":"3.171.112.202","method":"DELETE","location":"/first","status":"401","datetime":"2014-10-21T20:25:07.303Z"},{"date":"26/10/2014","time":"11:6:10","ip":"3.171.112.202","method":"DELETE","location":"/job/3","status":"500","datetime":"2014-10-26T10:06:10.303Z"},{"date":"25/12/2014","time":"16:30:11","ip":"3.171.112.202","method":"OPTIONS","location":"/resource","status":"404","datetime":"2014-12-25T15:30:11.303Z"},{"date":"9/1/2015","time":"6:1:14","ip":"3.171.112.202","method":"GET","location":"/resource1","status":"307","datetime":"2015-01-09T05:01:14.303Z"},{"date":"22/1/2015","time":"1:16:5","ip":"3.171.112.202","method":"POST","location":"/last","status":"400","datetime":"2015-01-22T00:16:05.303Z"},{"date":"13/2/2015","time":"12:33:42","ip":"3.171.112.202","method":"OPTIONS","location":"/resource1","status":"404","datetime":"2015-02-13T11:33:42.303Z"},{"date":"24/2/2015","time":"16:5:12","ip":"3.171.112.202","method":"DELETE","location":"/job/1/output","status":"204","datetime":"2015-02-24T15:05:12.303Z"},{"date":"14/3/2015","time":"23:52:17","ip":"3.171.112.202","method":"OPTIONS","location":"/last","status":"404","datetime":"2015-03-14T22:52:17.303Z"},{"date":"16/4/2015","time":"21:7:27","ip":"3.171.112.202","method":"OPTIONS","location":"/","status":"200","datetime":"2015-04-16T19:07:27.303Z"},{"date":"10/5/2015","time":"13:40:46","ip":"3.171.112.202","method":"POST","location":"/job","status":"200","datetime":"2015-05-10T11:40:46.303Z"},{"date":"11/6/2015","time":"7:33:5","ip":"3.171.112.202","method":"POST","location":"/last","status":"500","datetime":"2015-06-11T05:33:05.303Z"},{"date":"23/7/2015","time":"12:42:21","ip":"3.171.112.202","method":"POST","location":"/last","status":"500","datetime":"2015-07-23T10:42:21.303Z"},{"date":"29/7/2015","time":"10:14:20","ip":"3.171.112.202","method":"DELETE","location":"/job/3","status":"401","datetime":"2015-07-29T08:14:20.303Z"},{"date":"29/8/2015","time":"4:57:32","ip":"3.171.112.202","method":"OPTIONS","location":"/","status":"200","datetime":"2015-08-29T02:57:32.303Z"},{"date":"16/9/2015","time":"21:46:8","ip":"3.171.112.202","method":"PUT","location":"/resource1","status":"200","datetime":"2015-09-16T19:46:08.303Z"},{"date":"5/10/2015","time":"23:54:32","ip":"3.171.112.202","method":"GET","location":"/job","status":"301","datetime":"2015-10-05T21:54:32.303Z"},{"date":"8/2/2016","time":"22:57:39","ip":"3.171.112.202","method":"PUT","location":"/resource","status":"409","datetime":"2016-02-08T21:57:39.303Z"},{"date":"14/2/2016","time":"16:48:6","ip":"3.171.112.202","method":"GET","location":"/job/1/output","status":"308","datetime":"2016-02-14T15:48:06.303Z"},{"date":"19/2/2016","time":"3:21:3","ip":"3.171.112.202","method":"OPTIONS","location":"/job/3","status":"404","datetime":"2016-02-19T02:21:03.303Z"},{"date":"8/5/2016","time":"17:11:25","ip":"3.171.112.202","method":"POST","location":"/resource/edit","status":"404","datetime":"2016-05-08T15:11:25.303Z"},{"date":"5/6/2016","time":"22:59:9","ip":"3.171.112.202","method":"PUT","location":"/resource/edit","status":"409","datetime":"2016-06-05T20:59:09.303Z"},{"date":"9/7/2016","time":"0:41:45","ip":"3.171.112.202","method":"GET","location":"/prev","status":"200","datetime":"2016-07-08T22:41:45.303Z"},{"date":"23/7/2016","time":"2:48:27","ip":"3.171.112.202","method":"GET","location":"/first","status":"200","datetime":"2016-07-23T00:48:27.303Z"},{"date":"25/7/2016","time":"14:42:38","ip":"3.171.112.202","method":"POST","location":"/job/3","status":"202","datetime":"2016-07-25T12:42:38.303Z"},{"date":"8/9/2016","time":"0:10:58","ip":"3.171.112.202","method":"OPTIONS","location":"/prev","status":"200","datetime":"2016-09-07T22:10:58.303Z"},{"date":"21/9/2016","time":"20:32:3","ip":"3.171.112.202","method":"GET","location":"/job/2/output","status":"403","datetime":"2016-09-21T18:32:03.303Z"},{"date":"25/9/2016","time":"12:57:2","ip":"3.171.112.202","method":"DELETE","location":"/job/3","status":"404","datetime":"2016-09-25T10:57:02.303Z"},{"date":"2/10/2016","time":"15:36:6","ip":"3.171.112.202","method":"DELETE","location":"/job/1/output","status":"403","datetime":"2016-10-02T13:36:06.303Z"},{"date":"3/11/2016","time":"5:9:44","ip":"3.171.112.202","method":"OPTIONS","location":"/resource2","status":"200","datetime":"2016-11-03T04:09:44.303Z"},{"date":"6/1/2017","time":"4:31:33","ip":"3.171.112.202","method":"PUT","location":"/job/3","status":"500","datetime":"2017-01-06T03:31:33.303Z"},{"date":"12/3/2017","time":"1:16:25","ip":"3.171.112.202","method":"DELETE","location":"/resource/edit","status":"401","datetime":"2017-03-12T00:16:25.303Z"},{"date":"16/3/2017","time":"13:53:39","ip":"3.171.112.202","method":"POST","location":"/prev","status":"202","datetime":"2017-03-16T12:53:39.303Z"},{"date":"11/4/2017","time":"2:3:53","ip":"3.171.112.202","method":"OPTIONS","location":"/resource1","status":"200","datetime":"2017-04-11T00:03:53.303Z"},{"date":"6/5/2017","time":"22:45:50","ip":"3.171.112.202","method":"OPTIONS","location":"/first","status":"200","datetime":"2017-05-06T20:45:50.303Z"},{"date":"13/5/2017","time":"16:58:40","ip":"3.171.112.202","method":"PUT","location":"/first","status":"405","datetime":"2017-05-13T14:58:40.303Z"},{"date":"13/6/2017","time":"13:44:32","ip":"3.171.112.202","method":"OPTIONS","location":"/other","status":"404","datetime":"2017-06-13T11:44:32.303Z"},{"date":"28/6/2017","time":"13:58:5","ip":"3.171.112.202","method":"PUT","location":"/prev","status":"500","datetime":"2017-06-28T11:58:05.303Z"},{"date":"20/7/2017","time":"11:0:27","ip":"3.171.112.202","method":"POST","location":"/last","status":"401","datetime":"2017-07-20T09:00:27.303Z"},{"date":"3/8/2017","time":"17:51:8","ip":"3.171.112.202","method":"GET","location":"/job/2/output","status":"303","datetime":"2017-08-03T15:51:08.303Z"},{"date":"14/8/2017","time":"4:43:54","ip":"3.171.112.202","method":"OPTIONS","location":"/job/3","status":"404","datetime":"2017-08-14T02:43:54.303Z"},{"date":"7/9/2017","time":"7:21:51","ip":"3.171.112.202","method":"OPTIONS","location":"/resource/edit","status":"200","datetime":"2017-09-07T05:21:51.303Z"},{"date":"9/9/2017","time":"15:35:46","ip":"3.171.112.202","method":"GET","location":"/job/3","status":"500","datetime":"2017-09-09T13:35:46.303Z"},{"date":"10/9/2017","time":"17:28:34","ip":"3.171.112.202","method":"POST","location":"/other","status":"401","datetime":"2017-09-10T15:28:34.303Z"},{"date":"24/9/2017","time":"12:54:53","ip":"3.171.112.202","method":"GET","location":"/resource","status":"404","datetime":"2017-09-24T10:54:53.303Z"},{"date":"29/9/2017","time":"13:54:12","ip":"3.171.112.202","method":"GET","location":"/resource2","status":"404","datetime":"2017-09-29T11:54:12.303Z"},{"date":"10/10/2017","time":"1:42:36","ip":"3.171.112.202","method":"DELETE","location":"/job/3","status":"204","datetime":"2017-10-09T23:42:36.303Z"},{"date":"13/10/2017","time":"5:55:37","ip":"3.171.112.202","method":"PUT","location":"/","status":"200","datetime":"2017-10-13T03:55:37.303Z"},{"date":"14/10/2017","time":"20:2:29","ip":"3.171.112.202","method":"OPTIONS","location":"/resource1","status":"404","datetime":"2017-10-14T18:02:29.303Z"},{"date":"28/10/2017","time":"17:48:48","ip":"3.171.112.202","method":"OPTIONS","location":"/resource","status":"404","datetime":"2017-10-28T15:48:48.303Z"},{"date":"19/12/2017","time":"5:51:28","ip":"3.171.112.202","method":"DELETE","location":"/","status":"400","datetime":"2017-12-19T04:51:28.303Z"},{"date":"24/12/2017","time":"16:10:52","ip":"3.171.112.202","method":"PUT","location":"/resource2","status":"409","datetime":"2017-12-24T15:10:52.303Z"},{"date":"29/12/2017","time":"8:9:46","ip":"3.171.112.202","method":"GET","location":"/resource","status":"308","datetime":"2017-12-29T07:09:46.303Z"},{"date":"12/1/2018","time":"17:51:5","ip":"3.171.112.202","method":"OPTIONS","location":"/","status":"404","datetime":"2018-01-12T16:51:05.303Z"},{"date":"8/2/2018","time":"4:48:14","ip":"3.171.112.202","method":"DELETE","location":"/job/3","status":"403","datetime":"2018-02-08T03:48:14.303Z"},{"date":"20/2/2018","time":"19:0:51","ip":"3.171.112.202","method":"GET","location":"/resource2","status":"403","datetime":"2018-02-20T18:00:51.303Z"}],"153.22.95.165":[{"date":"26/1/2012","time":"4:30:3","ip":"153.22.95.165","method":"OPTIONS","location":"/first","status":"404","datetime":"2012-01-26T03:30:03.303Z"},{"date":"2/2/2012","time":"21:13:44","ip":"153.22.95.165","method":"GET","location":"/job/3","status":"401","datetime":"2012-02-02T20:13:44.304Z"},{"date":"28/3/2012","time":"4:21:43","ip":"153.22.95.165","method":"GET","location":"/job","status":"307","datetime":"2012-03-28T02:21:43.303Z"},{"date":"8/4/2012","time":"5:22:0","ip":"153.22.95.165","method":"OPTIONS","location":"/resource","status":"200","datetime":"2012-04-08T03:22:00.304Z"},{"date":"23/4/2012","time":"5:55:32","ip":"153.22.95.165","method":"DELETE","location":"/job/1/output","status":"400","datetime":"2012-04-23T03:55:32.303Z"},{"date":"14/6/2012","time":"14:36:45","ip":"153.22.95.165","method":"GET","location":"/job/2/output","status":"301","datetime":"2012-06-14T12:36:45.303Z"},{"date":"22/6/2012","time":"15:57:24","ip":"153.22.95.165","method":"OPTIONS","location":"/job/3","status":"404","datetime":"2012-06-22T13:57:24.303Z"},{"date":"8/7/2012","time":"9:31:2","ip":"153.22.95.165","method":"GET","location":"/other","status":"404","datetime":"2012-07-08T07:31:02.304Z"},{"date":"9/8/2012","time":"15:39:50","ip":"153.22.95.165","method":"PUT","location":"/first","status":"200","datetime":"2012-08-09T13:39:50.304Z"},{"date":"31/8/2012","time":"11:11:2","ip":"153.22.95.165","method":"POST","location":"/resource1","status":"404","datetime":"2012-08-31T09:11:02.304Z"},{"date":"26/9/2012","time":"0:58:7","ip":"153.22.95.165","method":"GET","location":"/job/3","status":"403","datetime":"2012-09-25T22:58:07.303Z"},{"date":"1/10/2012","time":"18:28:53","ip":"153.22.95.165","method":"OPTIONS","location":"/","status":"404","datetime":"2012-10-01T16:28:53.303Z"},{"date":"13/10/2012","time":"7:27:50","ip":"153.22.95.165","method":"OPTIONS","location":"/job","status":"404","datetime":"2012-10-13T05:27:50.303Z"},{"date":"13/10/2012","time":"18:6:12","ip":"153.22.95.165","method":"POST","location":"/resource2","status":"404","datetime":"2012-10-13T16:06:12.304Z"},{"date":"26/10/2012","time":"21:54:55","ip":"153.22.95.165","method":"PUT","location":"/resource2","status":"500","datetime":"2012-10-26T19:54:55.303Z"},{"date":"5/12/2012","time":"2:18:2","ip":"153.22.95.165","method":"OPTIONS","location":"/first","status":"200","datetime":"2012-12-05T01:18:02.304Z"},{"date":"30/12/2012","time":"9:17:59","ip":"153.22.95.165","method":"POST","location":"/job/2/output","status":"405","datetime":"2012-12-30T08:17:59.303Z"},{"date":"24/2/2013","time":"15:44:9","ip":"153.22.95.165","method":"POST","location":"/prev","status":"403","datetime":"2013-02-24T14:44:09.304Z"},{"date":"15/3/2013","time":"3:33:12","ip":"153.22.95.165","method":"POST","location":"/resource/edit","status":"201","datetime":"2013-03-15T02:33:12.304Z"},{"date":"20/3/2013","time":"13:5:0","ip":"153.22.95.165","method":"PUT","location":"/job","status":"401","datetime":"2013-03-20T12:05:00.304Z"},{"date":"24/4/2013","time":"11:17:49","ip":"153.22.95.165","method":"DELETE","location":"/","status":"404","datetime":"2013-04-24T09:17:49.304Z"},{"date":"27/5/2013","time":"10:1:36","ip":"153.22.95.165","method":"GET","location":"/next","status":"200","datetime":"2013-05-27T08:01:36.303Z"},{"date":"14/6/2013","time":"14:34:20","ip":"153.22.95.165","method":"PUT","location":"/job/2","status":"201","datetime":"2013-06-14T12:34:20.304Z"},{"date":"22/6/2013","time":"10:16:45","ip":"153.22.95.165","method":"OPTIONS","location":"/job/1/output","status":"200","datetime":"2013-06-22T08:16:45.303Z"},{"date":"5/7/2013","time":"20:26:23","ip":"153.22.95.165","method":"PUT","location":"/resource2","status":"401","datetime":"2013-07-05T18:26:23.303Z"},{"date":"7/7/2013","time":"11:2:8","ip":"153.22.95.165","method":"PUT","location":"/job/3","status":"200","datetime":"2013-07-07T09:02:08.304Z"},{"date":"23/7/2013","time":"13:46:2","ip":"153.22.95.165","method":"POST","location":"/last","status":"201","datetime":"2013-07-23T11:46:02.303Z"},{"date":"25/7/2013","time":"4:45:0","ip":"153.22.95.165","method":"DELETE","location":"/job/2/output","status":"500","datetime":"2013-07-25T02:45:00.303Z"},{"date":"12/9/2013","time":"19:50:43","ip":"153.22.95.165","method":"POST","location":"/resource/edit","status":"400","datetime":"2013-09-12T17:50:43.303Z"},{"date":"18/9/2013","time":"11:59:16","ip":"153.22.95.165","method":"POST","location":"/resource1","status":"403","datetime":"2013-09-18T09:59:16.304Z"},{"date":"23/9/2013","time":"7:49:21","ip":"153.22.95.165","method":"OPTIONS","location":"/job","status":"200","datetime":"2013-09-23T05:49:21.303Z"},{"date":"15/10/2013","time":"4:26:32","ip":"153.22.95.165","method":"DELETE","location":"/job/3","status":"403","datetime":"2013-10-15T02:26:32.303Z"},{"date":"1/11/2013","time":"19:50:47","ip":"153.22.95.165","method":"OPTIONS","location":"/job","status":"404","datetime":"2013-11-01T18:50:47.303Z"},{"date":"17/11/2013","time":"23:15:53","ip":"153.22.95.165","method":"DELETE","location":"/last","status":"500","datetime":"2013-11-17T22:15:53.304Z"},{"date":"22/11/2013","time":"13:31:31","ip":"153.22.95.165","method":"POST","location":"/","status":"404","datetime":"2013-11-22T12:31:31.304Z"},{"date":"25/11/2013","time":"8:16:0","ip":"153.22.95.165","method":"GET","location":"/job/3","status":"307","datetime":"2013-11-25T07:16:00.303Z"},{"date":"6/12/2013","time":"14:33:12","ip":"153.22.95.165","method":"DELETE","location":"/job/2/output","status":"204","datetime":"2013-12-06T13:33:12.304Z"},{"date":"7/12/2013","time":"8:53:37","ip":"153.22.95.165","method":"DELETE","location":"/job/1","status":"400","datetime":"2013-12-07T07:53:37.304Z"},{"date":"13/1/2014","time":"0:26:5","ip":"153.22.95.165","method":"GET","location":"/job/2","status":"308","datetime":"2014-01-12T23:26:05.304Z"},{"date":"17/1/2014","time":"2:1:11","ip":"153.22.95.165","method":"GET","location":"/other","status":"403","datetime":"2014-01-17T01:01:11.303Z"},{"date":"22/2/2014","time":"22:4:49","ip":"153.22.95.165","method":"GET","location":"/resource/edit","status":"404","datetime":"2014-02-22T21:04:49.304Z"},{"date":"15/3/2014","time":"21:9:25","ip":"153.22.95.165","method":"GET","location":"/job/3","status":"403","datetime":"2014-03-15T20:09:25.303Z"},{"date":"23/4/2014","time":"14:24:39","ip":"153.22.95.165","method":"GET","location":"/resource2","status":"404","datetime":"2014-04-23T12:24:39.304Z"},{"date":"30/4/2014","time":"10:50:54","ip":"153.22.95.165","method":"POST","location":"/job","status":"201","datetime":"2014-04-30T08:50:54.303Z"},{"date":"2/5/2014","time":"13:26:58","ip":"153.22.95.165","method":"GET","location":"/job/3","status":"401","datetime":"2014-05-02T11:26:58.303Z"},{"date":"18/5/2014","time":"5:52:45","ip":"153.22.95.165","method":"DELETE","location":"/job/3","status":"500","datetime":"2014-05-18T03:52:45.303Z"},{"date":"23/8/2014","time":"22:39:36","ip":"153.22.95.165","method":"GET","location":"/prev","status":"404","datetime":"2014-08-23T20:39:36.304Z"},{"date":"30/9/2014","time":"15:24:34","ip":"153.22.95.165","method":"GET","location":"/last","status":"401","datetime":"2014-09-30T13:24:34.303Z"},{"date":"1/11/2014","time":"17:18:41","ip":"153.22.95.165","method":"DELETE","location":"/job/2/output","status":"403","datetime":"2014-11-01T16:18:41.304Z"},{"date":"14/12/2014","time":"16:4:27","ip":"153.22.95.165","method":"GET","location":"/job/1/output","status":"404","datetime":"2014-12-14T15:04:27.303Z"},{"date":"20/12/2014","time":"14:55:30","ip":"153.22.95.165","method":"PUT","location":"/job/2","status":"200","datetime":"2014-12-20T13:55:30.304Z"},{"date":"25/12/2014","time":"12:30:31","ip":"153.22.95.165","method":"DELETE","location":"/job/2/output","status":"204","datetime":"2014-12-25T11:30:31.303Z"},{"date":"1/2/2015","time":"7:6:33","ip":"153.22.95.165","method":"POST","location":"/job/1","status":"202","datetime":"2015-02-01T06:06:33.304Z"},{"date":"3/2/2015","time":"11:30:19","ip":"153.22.95.165","method":"DELETE","location":"/resource/edit","status":"405","datetime":"2015-02-03T10:30:19.303Z"},{"date":"2/4/2015","time":"19:44:51","ip":"153.22.95.165","method":"GET","location":"/job/1/output","status":"303","datetime":"2015-04-02T17:44:51.304Z"},{"date":"8/4/2015","time":"16:48:31","ip":"153.22.95.165","method":"GET","location":"/job/2","status":"404","datetime":"2015-04-08T14:48:31.304Z"},{"date":"21/4/2015","time":"12:16:16","ip":"153.22.95.165","method":"PUT","location":"/","status":"500","datetime":"2015-04-21T10:16:16.304Z"},{"date":"27/4/2015","time":"5:17:12","ip":"153.22.95.165","method":"POST","location":"/next","status":"401","datetime":"2015-04-27T03:17:12.304Z"},{"date":"11/5/2015","time":"21:39:26","ip":"153.22.95.165","method":"OPTIONS","location":"/job/1/output","status":"200","datetime":"2015-05-11T19:39:26.303Z"},{"date":"28/5/2015","time":"8:52:35","ip":"153.22.95.165","method":"PUT","location":"/job/1/output","status":"409","datetime":"2015-05-28T06:52:35.304Z"},{"date":"21/6/2015","time":"3:55:19","ip":"153.22.95.165","method":"DELETE","location":"/resource","status":"403","datetime":"2015-06-21T01:55:19.304Z"},{"date":"25/9/2015","time":"5:30:19","ip":"153.22.95.165","method":"PUT","location":"/first","status":"400","datetime":"2015-09-25T03:30:19.303Z"},{"date":"28/10/2015","time":"8:10:0","ip":"153.22.95.165","method":"DELETE","location":"/job","status":"405","datetime":"2015-10-28T07:10:00.303Z"},{"date":"1/11/2015","time":"21:2:3","ip":"153.22.95.165","method":"PUT","location":"/job/1","status":"409","datetime":"2015-11-01T20:02:03.304Z"},{"date":"12/12/2015","time":"11:21:54","ip":"153.22.95.165","method":"DELETE","location":"/resource2","status":"204","datetime":"2015-12-12T10:21:54.304Z"},{"date":"30/12/2015","time":"7:19:39","ip":"153.22.95.165","method":"PUT","location":"/first","status":"400","datetime":"2015-12-30T06:19:39.304Z"},{"date":"13/1/2016","time":"1:7:22","ip":"153.22.95.165","method":"OPTIONS","location":"/prev","status":"404","datetime":"2016-01-13T00:07:22.304Z"},{"date":"19/1/2016","time":"4:42:44","ip":"153.22.95.165","method":"PUT","location":"/job/2","status":"200","datetime":"2016-01-19T03:42:44.303Z"},{"date":"10/3/2016","time":"8:27:16","ip":"153.22.95.165","method":"GET","location":"/job/1/output","status":"200","datetime":"2016-03-10T07:27:16.303Z"},{"date":"3/4/2016","time":"18:6:2","ip":"153.22.95.165","method":"PUT","location":"/last","status":"200","datetime":"2016-04-03T16:06:02.303Z"},{"date":"1/5/2016","time":"13:24:18","ip":"153.22.95.165","method":"DELETE","location":"/other","status":"405","datetime":"2016-05-01T11:24:18.303Z"},{"date":"21/5/2016","time":"11:18:53","ip":"153.22.95.165","method":"POST","location":"/job/3","status":"403","datetime":"2016-05-21T09:18:53.304Z"},{"date":"11/6/2016","time":"10:33:38","ip":"153.22.95.165","method":"OPTIONS","location":"/prev","status":"404","datetime":"2016-06-11T08:33:38.304Z"},{"date":"19/6/2016","time":"10:40:46","ip":"153.22.95.165","method":"OPTIONS","location":"/job","status":"404","datetime":"2016-06-19T08:40:46.304Z"},{"date":"26/6/2016","time":"8:45:27","ip":"153.22.95.165","method":"OPTIONS","location":"/job/1/output","status":"200","datetime":"2016-06-26T06:45:27.303Z"},{"date":"7/7/2016","time":"9:18:49","ip":"153.22.95.165","method":"OPTIONS","location":"/last","status":"404","datetime":"2016-07-07T07:18:49.303Z"},{"date":"13/7/2016","time":"19:4:6","ip":"153.22.95.165","method":"POST","location":"/job/3","status":"405","datetime":"2016-07-13T17:04:06.304Z"},{"date":"4/8/2016","time":"19:12:1","ip":"153.22.95.165","method":"POST","location":"/job","status":"202","datetime":"2016-08-04T17:12:01.303Z"},{"date":"5/8/2016","time":"1:55:39","ip":"153.22.95.165","method":"DELETE","location":"/resource2","status":"404","datetime":"2016-08-04T23:55:39.304Z"},{"date":"26/8/2016","time":"21:41:41","ip":"153.22.95.165","method":"OPTIONS","location":"/first","status":"200","datetime":"2016-08-26T19:41:41.304Z"},{"date":"11/9/2016","time":"8:34:49","ip":"153.22.95.165","method":"PUT","location":"/prev","status":"405","datetime":"2016-09-11T06:34:49.303Z"},{"date":"23/9/2016","time":"6:12:27","ip":"153.22.95.165","method":"POST","location":"/job/2/output","status":"405","datetime":"2016-09-23T04:12:27.304Z"},{"date":"23/10/2016","time":"5:57:6","ip":"153.22.95.165","method":"PUT","location":"/job/1","status":"409","datetime":"2016-10-23T03:57:06.304Z"},{"date":"13/11/2016","time":"7:17:2","ip":"153.22.95.165","method":"DELETE","location":"/first","status":"403","datetime":"2016-11-13T06:17:02.303Z"},{"date":"22/11/2016","time":"18:26:10","ip":"153.22.95.165","method":"OPTIONS","location":"/","status":"404","datetime":"2016-11-22T17:26:10.304Z"},{"date":"27/1/2017","time":"5:12:17","ip":"153.22.95.165","method":"PUT","location":"/last","status":"200","datetime":"2017-01-27T04:12:17.304Z"},{"date":"28/1/2017","time":"20:50:46","ip":"153.22.95.165","method":"PUT","location":"/job/3","status":"200","datetime":"2017-01-28T19:50:46.303Z"},{"date":"19/2/2017","time":"4:51:39","ip":"153.22.95.165","method":"DELETE","location":"/job/1","status":"404","datetime":"2017-02-19T03:51:39.303Z"},{"date":"4/3/2017","time":"12:36:48","ip":"153.22.95.165","method":"OPTIONS","location":"/job/1/output","status":"200","datetime":"2017-03-04T11:36:48.304Z"},{"date":"15/3/2017","time":"0:42:58","ip":"153.22.95.165","method":"PUT","location":"/job/3","status":"401","datetime":"2017-03-14T23:42:58.304Z"},{"date":"14/5/2017","time":"9:14:36","ip":"153.22.95.165","method":"OPTIONS","location":"/next","status":"404","datetime":"2017-05-14T07:14:36.304Z"},{"date":"1/6/2017","time":"0:47:35","ip":"153.22.95.165","method":"POST","location":"/prev","status":"401","datetime":"2017-05-31T22:47:35.304Z"},{"date":"6/6/2017","time":"4:31:6","ip":"153.22.95.165","method":"OPTIONS","location":"/resource1","status":"404","datetime":"2017-06-06T02:31:06.303Z"},{"date":"25/6/2017","time":"13:25:58","ip":"153.22.95.165","method":"GET","location":"/other","status":"404","datetime":"2017-06-25T11:25:58.304Z"},{"date":"3/7/2017","time":"17:14:3","ip":"153.22.95.165","method":"OPTIONS","location":"/","status":"404","datetime":"2017-07-03T15:14:03.303Z"},{"date":"16/7/2017","time":"12:40:33","ip":"153.22.95.165","method":"PUT","location":"/first","status":"403","datetime":"2017-07-16T10:40:33.303Z"},{"date":"10/10/2017","time":"21:57:11","ip":"153.22.95.165","method":"GET","location":"/job/3","status":"403","datetime":"2017-10-10T19:57:11.303Z"},{"date":"19/11/2017","time":"9:11:17","ip":"153.22.95.165","method":"PUT","location":"/job/2/output","status":"409","datetime":"2017-11-19T08:11:17.304Z"},{"date":"28/11/2017","time":"8:6:23","ip":"153.22.95.165","method":"POST","location":"/job/3","status":"404","datetime":"2017-11-28T07:06:23.304Z"},{"date":"15/12/2017","time":"20:26:12","ip":"153.22.95.165","method":"DELETE","location":"/job/3","status":"500","datetime":"2017-12-15T19:26:12.304Z"},{"date":"11/1/2018","time":"13:20:21","ip":"153.22.95.165","method":"POST","location":"/job/3","status":"500","datetime":"2018-01-11T12:20:21.303Z"},{"date":"19/1/2018","time":"5:23:3","ip":"153.22.95.165","method":"DELETE","location":"/last","status":"405","datetime":"2018-01-19T04:23:03.304Z"},{"date":"23/1/2018","time":"4:6:35","ip":"153.22.95.165","method":"PUT","location":"/job/3","status":"401","datetime":"2018-01-23T03:06:35.304Z"},{"date":"29/1/2018","time":"16:4:57","ip":"153.22.95.165","method":"OPTIONS","location":"/job/3","status":"404","datetime":"2018-01-29T15:04:57.304Z"},{"date":"30/1/2018","time":"17:49:59","ip":"153.22.95.165","method":"OPTIONS","location":"/resource1","status":"200","datetime":"2018-01-30T16:49:59.304Z"},{"date":"4/2/2018","time":"13:54:47","ip":"153.22.95.165","method":"GET","location":"/job/1","status":"308","datetime":"2018-02-04T12:54:47.303Z"},{"date":"20/2/2018","time":"6:34:53","ip":"153.22.95.165","method":"DELETE","location":"/job/2","status":"401","datetime":"2018-02-20T05:34:53.303Z"},{"date":"22/2/2018","time":"14:57:42","ip":"153.22.95.165","method":"DELETE","location":"/job/3","status":"204","datetime":"2018-02-22T13:57:42.303Z"},{"date":"25/2/2018","time":"0:19:58","ip":"153.22.95.165","method":"POST","location":"/next","status":"400","datetime":"2018-02-24T23:19:58.303Z"}],"154.103.165.66":[{"date":"20/2/2012","time":"23:58:23","ip":"154.103.165.66","method":"PUT","location":"/resource2","status":"201","datetime":"2012-02-20T22:58:23.304Z"},{"date":"5/4/2012","time":"17:11:27","ip":"154.103.165.66","method":"GET","location":"/job/1/output","status":"403","datetime":"2012-04-05T15:11:27.304Z"},{"date":"1/5/2012","time":"7:14:30","ip":"154.103.165.66","method":"OPTIONS","location":"/first","status":"200","datetime":"2012-05-01T05:14:30.304Z"},{"date":"9/6/2012","time":"13:41:20","ip":"154.103.165.66","method":"GET","location":"/job/1","status":"401","datetime":"2012-06-09T11:41:20.304Z"},{"date":"12/6/2012","time":"11:8:2","ip":"154.103.165.66","method":"GET","location":"/resource1","status":"401","datetime":"2012-06-12T09:08:02.304Z"},{"date":"23/7/2012","time":"8:1:31","ip":"154.103.165.66","method":"POST","location":"/other","status":"201","datetime":"2012-07-23T06:01:31.304Z"},{"date":"27/7/2012","time":"1:30:54","ip":"154.103.165.66","method":"GET","location":"/job","status":"500","datetime":"2012-07-26T23:30:54.304Z"},{"date":"28/7/2012","time":"13:54:4","ip":"154.103.165.66","method":"OPTIONS","location":"/resource1","status":"404","datetime":"2012-07-28T11:54:04.304Z"},{"date":"13/8/2012","time":"6:42:54","ip":"154.103.165.66","method":"OPTIONS","location":"/job/1/output","status":"404","datetime":"2012-08-13T04:42:54.304Z"},{"date":"20/8/2012","time":"17:21:30","ip":"154.103.165.66","method":"PUT","location":"/resource1","status":"500","datetime":"2012-08-20T15:21:30.304Z"},{"date":"20/9/2012","time":"17:35:43","ip":"154.103.165.66","method":"DELETE","location":"/job","status":"500","datetime":"2012-09-20T15:35:43.304Z"},{"date":"10/11/2012","time":"15:18:53","ip":"154.103.165.66","method":"GET","location":"/job/1","status":"308","datetime":"2012-11-10T14:18:53.304Z"},{"date":"23/11/2012","time":"3:8:49","ip":"154.103.165.66","method":"POST","location":"/other","status":"200","datetime":"2012-11-23T02:08:49.304Z"},{"date":"20/12/2012","time":"20:49:57","ip":"154.103.165.66","method":"GET","location":"/job/3","status":"403","datetime":"2012-12-20T19:49:57.304Z"},{"date":"14/1/2013","time":"4:3:11","ip":"154.103.165.66","method":"POST","location":"/next","status":"202","datetime":"2013-01-14T03:03:11.304Z"},{"date":"16/3/2013","time":"8:46:21","ip":"154.103.165.66","method":"GET","location":"/job/2","status":"303","datetime":"2013-03-16T07:46:21.304Z"},{"date":"1/4/2013","time":"18:21:25","ip":"154.103.165.66","method":"GET","location":"/job/2","status":"301","datetime":"2013-04-01T16:21:25.304Z"},{"date":"27/4/2013","time":"18:57:45","ip":"154.103.165.66","method":"DELETE","location":"/job","status":"400","datetime":"2013-04-27T16:57:45.304Z"},{"date":"8/5/2013","time":"11:40:22","ip":"154.103.165.66","method":"OPTIONS","location":"/other","status":"200","datetime":"2013-05-08T09:40:22.304Z"},{"date":"2/6/2013","time":"4:16:14","ip":"154.103.165.66","method":"POST","location":"/resource/edit","status":"403","datetime":"2013-06-02T02:16:14.304Z"},{"date":"13/6/2013","time":"23:38:38","ip":"154.103.165.66","method":"OPTIONS","location":"/job/2/output","status":"200","datetime":"2013-06-13T21:38:38.304Z"},{"date":"4/7/2013","time":"8:43:18","ip":"154.103.165.66","method":"GET","location":"/other","status":"303","datetime":"2013-07-04T06:43:18.304Z"},{"date":"4/9/2013","time":"2:34:41","ip":"154.103.165.66","method":"GET","location":"/last","status":"308","datetime":"2013-09-04T00:34:41.304Z"},{"date":"24/9/2013","time":"19:39:47","ip":"154.103.165.66","method":"DELETE","location":"/job/1","status":"400","datetime":"2013-09-24T17:39:47.304Z"},{"date":"9/12/2013","time":"15:45:6","ip":"154.103.165.66","method":"PUT","location":"/job/1","status":"405","datetime":"2013-12-09T14:45:06.304Z"},{"date":"10/12/2013","time":"0:13:14","ip":"154.103.165.66","method":"GET","location":"/resource2","status":"404","datetime":"2013-12-09T23:13:14.304Z"},{"date":"10/12/2013","time":"9:52:35","ip":"154.103.165.66","method":"POST","location":"/job/1/output","status":"202","datetime":"2013-12-10T08:52:35.304Z"},{"date":"12/12/2013","time":"10:3:41","ip":"154.103.165.66","method":"GET","location":"/resource/edit","status":"500","datetime":"2013-12-12T09:03:41.304Z"},{"date":"19/12/2013","time":"15:8:15","ip":"154.103.165.66","method":"POST","location":"/prev","status":"400","datetime":"2013-12-19T14:08:15.304Z"},{"date":"23/12/2013","time":"16:41:20","ip":"154.103.165.66","method":"PUT","location":"/next","status":"200","datetime":"2013-12-23T15:41:20.304Z"},{"date":"26/12/2013","time":"11:2:5","ip":"154.103.165.66","method":"OPTIONS","location":"/other","status":"404","datetime":"2013-12-26T10:02:05.304Z"},{"date":"13/1/2014","time":"19:40:5","ip":"154.103.165.66","method":"DELETE","location":"/resource1","status":"500","datetime":"2014-01-13T18:40:05.304Z"},{"date":"31/1/2014","time":"18:4:22","ip":"154.103.165.66","method":"DELETE","location":"/last","status":"204","datetime":"2014-01-31T17:04:22.304Z"},{"date":"23/2/2014","time":"15:54:7","ip":"154.103.165.66","method":"POST","location":"/prev","status":"405","datetime":"2014-02-23T14:54:07.304Z"},{"date":"10/4/2014","time":"23:50:16","ip":"154.103.165.66","method":"PUT","location":"/job","status":"409","datetime":"2014-04-10T21:50:16.304Z"},{"date":"20/4/2014","time":"2:34:24","ip":"154.103.165.66","method":"OPTIONS","location":"/next","status":"200","datetime":"2014-04-20T00:34:24.304Z"},{"date":"2/5/2014","time":"4:8:49","ip":"154.103.165.66","method":"POST","location":"/job/2/output","status":"200","datetime":"2014-05-02T02:08:49.304Z"},{"date":"14/6/2014","time":"0:17:31","ip":"154.103.165.66","method":"POST","location":"/job/1","status":"400","datetime":"2014-06-13T22:17:31.304Z"},{"date":"2/7/2014","time":"23:57:15","ip":"154.103.165.66","method":"OPTIONS","location":"/job","status":"404","datetime":"2014-07-02T21:57:15.304Z"},{"date":"5/7/2014","time":"20:45:0","ip":"154.103.165.66","method":"DELETE","location":"/job/3","status":"204","datetime":"2014-07-05T18:45:00.304Z"},{"date":"20/7/2014","time":"16:18:12","ip":"154.103.165.66","method":"POST","location":"/job/1","status":"202","datetime":"2014-07-20T14:18:12.304Z"},{"date":"6/8/2014","time":"10:55:16","ip":"154.103.165.66","method":"GET","location":"/next","status":"307","datetime":"2014-08-06T08:55:16.304Z"},{"date":"19/9/2014","time":"18:59:37","ip":"154.103.165.66","method":"PUT","location":"/prev","status":"400","datetime":"2014-09-19T16:59:37.304Z"},{"date":"13/10/2014","time":"9:26:28","ip":"154.103.165.66","method":"DELETE","location":"/job/2","status":"204","datetime":"2014-10-13T07:26:28.304Z"},{"date":"1/11/2014","time":"6:1:17","ip":"154.103.165.66","method":"POST","location":"/resource1","status":"200","datetime":"2014-11-01T05:01:17.304Z"},{"date":"4/11/2014","time":"0:42:24","ip":"154.103.165.66","method":"POST","location":"/job/2/output","status":"405","datetime":"2014-11-03T23:42:24.304Z"},{"date":"10/12/2014","time":"1:47:41","ip":"154.103.165.66","method":"GET","location":"/job/2","status":"200","datetime":"2014-12-10T00:47:41.304Z"},{"date":"20/2/2015","time":"13:48:5","ip":"154.103.165.66","method":"GET","location":"/job/2/output","status":"303","datetime":"2015-02-20T12:48:05.304Z"},{"date":"12/3/2015","time":"2:32:32","ip":"154.103.165.66","method":"POST","location":"/job/1/output","status":"401","datetime":"2015-03-12T01:32:32.304Z"},{"date":"9/4/2015","time":"15:35:29","ip":"154.103.165.66","method":"POST","location":"/job/2/output","status":"405","datetime":"2015-04-09T13:35:29.304Z"},{"date":"19/4/2015","time":"2:39:15","ip":"154.103.165.66","method":"PUT","location":"/job/3","status":"401","datetime":"2015-04-19T00:39:15.304Z"},{"date":"22/4/2015","time":"19:41:35","ip":"154.103.165.66","method":"OPTIONS","location":"/job/3","status":"200","datetime":"2015-04-22T17:41:35.304Z"},{"date":"2/5/2015","time":"10:55:56","ip":"154.103.165.66","method":"OPTIONS","location":"/job/2","status":"404","datetime":"2015-05-02T08:55:56.304Z"},{"date":"8/5/2015","time":"13:16:43","ip":"154.103.165.66","method":"POST","location":"/job/2/output","status":"400","datetime":"2015-05-08T11:16:43.304Z"},{"date":"10/5/2015","time":"23:14:24","ip":"154.103.165.66","method":"GET","location":"/job/3","status":"308","datetime":"2015-05-10T21:14:24.304Z"},{"date":"30/6/2015","time":"11:26:40","ip":"154.103.165.66","method":"PUT","location":"/prev","status":"401","datetime":"2015-06-30T09:26:40.304Z"},{"date":"26/9/2015","time":"10:13:58","ip":"154.103.165.66","method":"POST","location":"/next","status":"405","datetime":"2015-09-26T08:13:58.304Z"},{"date":"29/9/2015","time":"17:46:4","ip":"154.103.165.66","method":"GET","location":"/other","status":"500","datetime":"2015-09-29T15:46:04.304Z"},{"date":"8/11/2015","time":"12:8:21","ip":"154.103.165.66","method":"OPTIONS","location":"/resource2","status":"200","datetime":"2015-11-08T11:08:21.304Z"},{"date":"18/11/2015","time":"21:5:48","ip":"154.103.165.66","method":"OPTIONS","location":"/job/3","status":"200","datetime":"2015-11-18T20:05:48.304Z"},{"date":"18/11/2015","time":"22:48:36","ip":"154.103.165.66","method":"GET","location":"/job/1/output","status":"308","datetime":"2015-11-18T21:48:36.304Z"},{"date":"7/12/2015","time":"9:33:1","ip":"154.103.165.66","method":"OPTIONS","location":"/job/3","status":"200","datetime":"2015-12-07T08:33:01.304Z"},{"date":"11/12/2015","time":"8:48:44","ip":"154.103.165.66","method":"GET","location":"/first","status":"401","datetime":"2015-12-11T07:48:44.304Z"},{"date":"9/2/2016","time":"15:50:39","ip":"154.103.165.66","method":"GET","location":"/job/2/output","status":"401","datetime":"2016-02-09T14:50:39.304Z"},{"date":"10/2/2016","time":"4:41:17","ip":"154.103.165.66","method":"OPTIONS","location":"/resource2","status":"200","datetime":"2016-02-10T03:41:17.304Z"},{"date":"6/3/2016","time":"19:22:22","ip":"154.103.165.66","method":"PUT","location":"/job/2/output","status":"200","datetime":"2016-03-06T18:22:22.304Z"},{"date":"15/3/2016","time":"0:9:5","ip":"154.103.165.66","method":"DELETE","location":"/job/2","status":"404","datetime":"2016-03-14T23:09:05.304Z"},{"date":"30/3/2016","time":"11:49:8","ip":"154.103.165.66","method":"PUT","location":"/job/1","status":"403","datetime":"2016-03-30T09:49:08.304Z"},{"date":"25/4/2016","time":"19:39:32","ip":"154.103.165.66","method":"OPTIONS","location":"/resource1","status":"404","datetime":"2016-04-25T17:39:32.304Z"},{"date":"27/4/2016","time":"15:9:35","ip":"154.103.165.66","method":"OPTIONS","location":"/resource/edit","status":"200","datetime":"2016-04-27T13:09:35.304Z"},{"date":"22/5/2016","time":"22:27:28","ip":"154.103.165.66","method":"PUT","location":"/job/1/output","status":"200","datetime":"2016-05-22T20:27:28.304Z"},{"date":"5/6/2016","time":"0:50:15","ip":"154.103.165.66","method":"GET","location":"/resource1","status":"500","datetime":"2016-06-04T22:50:15.304Z"},{"date":"15/7/2016","time":"22:56:44","ip":"154.103.165.66","method":"PUT","location":"/","status":"500","datetime":"2016-07-15T20:56:44.304Z"},{"date":"27/7/2016","time":"8:28:36","ip":"154.103.165.66","method":"PUT","location":"/","status":"409","datetime":"2016-07-27T06:28:36.304Z"},{"date":"31/7/2016","time":"0:46:23","ip":"154.103.165.66","method":"OPTIONS","location":"/resource2","status":"200","datetime":"2016-07-30T22:46:23.304Z"},{"date":"16/9/2016","time":"5:43:38","ip":"154.103.165.66","method":"DELETE","location":"/job/1/output","status":"400","datetime":"2016-09-16T03:43:38.304Z"},{"date":"20/9/2016","time":"12:56:41","ip":"154.103.165.66","method":"POST","location":"/job/2/output","status":"201","datetime":"2016-09-20T10:56:41.304Z"},{"date":"1/10/2016","time":"19:27:21","ip":"154.103.165.66","method":"OPTIONS","location":"/resource1","status":"200","datetime":"2016-10-01T17:27:21.304Z"},{"date":"14/10/2016","time":"18:26:9","ip":"154.103.165.66","method":"OPTIONS","location":"/prev","status":"404","datetime":"2016-10-14T16:26:09.304Z"},{"date":"3/12/2016","time":"12:16:0","ip":"154.103.165.66","method":"OPTIONS","location":"/job/3","status":"404","datetime":"2016-12-03T11:16:00.304Z"},{"date":"15/12/2016","time":"17:35:5","ip":"154.103.165.66","method":"GET","location":"/resource1","status":"308","datetime":"2016-12-15T16:35:05.304Z"},{"date":"14/1/2017","time":"19:33:0","ip":"154.103.165.66","method":"POST","location":"/","status":"201","datetime":"2017-01-14T18:33:00.304Z"},{"date":"5/2/2017","time":"23:33:28","ip":"154.103.165.66","method":"GET","location":"/prev","status":"403","datetime":"2017-02-05T22:33:28.304Z"},{"date":"9/4/2017","time":"3:43:21","ip":"154.103.165.66","method":"POST","location":"/resource2","status":"400","datetime":"2017-04-09T01:43:21.304Z"},{"date":"24/5/2017","time":"19:8:6","ip":"154.103.165.66","method":"DELETE","location":"/resource2","status":"500","datetime":"2017-05-24T17:08:06.304Z"},{"date":"29/5/2017","time":"14:9:15","ip":"154.103.165.66","method":"POST","location":"/job/1","status":"400","datetime":"2017-05-29T12:09:15.304Z"},{"date":"31/5/2017","time":"19:43:40","ip":"154.103.165.66","method":"GET","location":"/job/2","status":"401","datetime":"2017-05-31T17:43:40.304Z"},{"date":"19/6/2017","time":"5:40:17","ip":"154.103.165.66","method":"PUT","location":"/job/2","status":"409","datetime":"2017-06-19T03:40:17.304Z"},{"date":"1/8/2017","time":"14:57:36","ip":"154.103.165.66","method":"GET","location":"/job/3","status":"404","datetime":"2017-08-01T12:57:36.304Z"},{"date":"9/8/2017","time":"11:20:37","ip":"154.103.165.66","method":"POST","location":"/first","status":"201","datetime":"2017-08-09T09:20:37.304Z"},{"date":"13/8/2017","time":"12:46:27","ip":"154.103.165.66","method":"POST","location":"/job/3","status":"405","datetime":"2017-08-13T10:46:27.304Z"},{"date":"29/8/2017","time":"8:15:37","ip":"154.103.165.66","method":"GET","location":"/job/2/output","status":"401","datetime":"2017-08-29T06:15:37.304Z"},{"date":"4/9/2017","time":"9:59:48","ip":"154.103.165.66","method":"OPTIONS","location":"/last","status":"200","datetime":"2017-09-04T07:59:48.304Z"},{"date":"9/9/2017","time":"8:32:17","ip":"154.103.165.66","method":"GET","location":"/resource2","status":"401","datetime":"2017-09-09T06:32:17.304Z"},{"date":"25/9/2017","time":"23:25:27","ip":"154.103.165.66","method":"OPTIONS","location":"/job/3","status":"200","datetime":"2017-09-25T21:25:27.304Z"},{"date":"28/9/2017","time":"17:36:54","ip":"154.103.165.66","method":"GET","location":"/job/2/output","status":"303","datetime":"2017-09-28T15:36:54.304Z"},{"date":"16/10/2017","time":"16:6:48","ip":"154.103.165.66","method":"GET","location":"/job/1","status":"200","datetime":"2017-10-16T14:06:48.304Z"},{"date":"17/10/2017","time":"14:43:8","ip":"154.103.165.66","method":"PUT","location":"/last","status":"409","datetime":"2017-10-17T12:43:08.304Z"},{"date":"31/10/2017","time":"13:27:2","ip":"154.103.165.66","method":"PUT","location":"/job/3","status":"409","datetime":"2017-10-31T12:27:02.304Z"},{"date":"6/11/2017","time":"10:1:41","ip":"154.103.165.66","method":"POST","location":"/resource1","status":"202","datetime":"2017-11-06T09:01:41.304Z"},{"date":"31/12/2017","time":"10:36:27","ip":"154.103.165.66","method":"POST","location":"/resource/edit","status":"200","datetime":"2017-12-31T09:36:27.304Z"},{"date":"31/12/2017","time":"10:56:4","ip":"154.103.165.66","method":"POST","location":"/resource","status":"401","datetime":"2017-12-31T09:56:04.304Z"},{"date":"10/1/2018","time":"4:47:19","ip":"154.103.165.66","method":"POST","location":"/job/3","status":"405","datetime":"2018-01-10T03:47:19.304Z"},{"date":"16/2/2018","time":"20:27:44","ip":"154.103.165.66","method":"DELETE","location":"/job/1","status":"401","datetime":"2018-02-16T19:27:44.304Z"},{"date":"1/3/2018","time":"6:20:22","ip":"154.103.165.66","method":"POST","location":"/other","status":"201","datetime":"2018-03-01T05:20:22.304Z"}],"11.20.201.17":[{"date":"1/2/2012","time":"22:52:19","ip":"11.20.201.17","method":"POST","location":"/job/2","status":"200","datetime":"2012-02-01T21:52:19.304Z"},{"date":"29/3/2012","time":"18:48:8","ip":"11.20.201.17","method":"PUT","location":"/first","status":"500","datetime":"2012-03-29T16:48:08.304Z"},{"date":"14/4/2012","time":"8:28:49","ip":"11.20.201.17","method":"GET","location":"/job/3","status":"403","datetime":"2012-04-14T06:28:49.304Z"},{"date":"30/4/2012","time":"20:47:32","ip":"11.20.201.17","method":"PUT","location":"/next","status":"409","datetime":"2012-04-30T18:47:32.304Z"},{"date":"10/5/2012","time":"23:58:42","ip":"11.20.201.17","method":"GET","location":"/","status":"301","datetime":"2012-05-10T21:58:42.304Z"},{"date":"13/5/2012","time":"21:21:34","ip":"11.20.201.17","method":"DELETE","location":"/job/3","status":"404","datetime":"2012-05-13T19:21:34.304Z"},{"date":"2/6/2012","time":"13:21:13","ip":"11.20.201.17","method":"OPTIONS","location":"/job/2","status":"200","datetime":"2012-06-02T11:21:13.304Z"},{"date":"29/7/2012","time":"3:23:35","ip":"11.20.201.17","method":"GET","location":"/resource1","status":"200","datetime":"2012-07-29T01:23:35.304Z"},{"date":"11/9/2012","time":"12:2:11","ip":"11.20.201.17","method":"OPTIONS","location":"/resource/edit","status":"200","datetime":"2012-09-11T10:02:11.304Z"},{"date":"18/9/2012","time":"1:16:30","ip":"11.20.201.17","method":"POST","location":"/","status":"405","datetime":"2012-09-17T23:16:30.304Z"},{"date":"15/10/2012","time":"6:54:23","ip":"11.20.201.17","method":"PUT","location":"/","status":"405","datetime":"2012-10-15T04:54:23.304Z"},{"date":"31/10/2012","time":"9:47:59","ip":"11.20.201.17","method":"OPTIONS","location":"/job/3","status":"200","datetime":"2012-10-31T08:47:59.304Z"},{"date":"23/11/2012","time":"4:50:53","ip":"11.20.201.17","method":"POST","location":"/other","status":"404","datetime":"2012-11-23T03:50:53.304Z"},{"date":"4/1/2013","time":"19:11:20","ip":"11.20.201.17","method":"POST","location":"/job/2/output","status":"500","datetime":"2013-01-04T18:11:20.304Z"},{"date":"14/1/2013","time":"4:22:53","ip":"11.20.201.17","method":"POST","location":"/first","status":"405","datetime":"2013-01-14T03:22:53.304Z"},{"date":"14/1/2013","time":"4:30:49","ip":"11.20.201.17","method":"GET","location":"/job","status":"301","datetime":"2013-01-14T03:30:49.304Z"},{"date":"16/1/2013","time":"16:8:35","ip":"11.20.201.17","method":"PUT","location":"/job","status":"403","datetime":"2013-01-16T15:08:35.304Z"},{"date":"21/2/2013","time":"12:57:26","ip":"11.20.201.17","method":"POST","location":"/next","status":"401","datetime":"2013-02-21T11:57:26.304Z"},{"date":"27/3/2013","time":"7:14:16","ip":"11.20.201.17","method":"OPTIONS","location":"/job","status":"200","datetime":"2013-03-27T06:14:16.304Z"},{"date":"20/4/2013","time":"23:15:37","ip":"11.20.201.17","method":"DELETE","location":"/next","status":"500","datetime":"2013-04-20T21:15:37.304Z"},{"date":"22/4/2013","time":"22:5:58","ip":"11.20.201.17","method":"DELETE","location":"/job","status":"401","datetime":"2013-04-22T20:05:58.304Z"},{"date":"10/6/2013","time":"0:35:31","ip":"11.20.201.17","method":"POST","location":"/job/1","status":"202","datetime":"2013-06-09T22:35:31.304Z"},{"date":"17/7/2013","time":"21:39:9","ip":"11.20.201.17","method":"PUT","location":"/job/1/output","status":"409","datetime":"2013-07-17T19:39:09.304Z"},{"date":"24/7/2013","time":"10:23:46","ip":"11.20.201.17","method":"GET","location":"/other","status":"308","datetime":"2013-07-24T08:23:46.304Z"},{"date":"6/9/2013","time":"13:53:29","ip":"11.20.201.17","method":"PUT","location":"/job/2","status":"201","datetime":"2013-09-06T11:53:29.304Z"},{"date":"18/9/2013","time":"10:31:45","ip":"11.20.201.17","method":"POST","location":"/job","status":"201","datetime":"2013-09-18T08:31:45.304Z"},{"date":"3/11/2013","time":"16:22:14","ip":"11.20.201.17","method":"POST","location":"/prev","status":"405","datetime":"2013-11-03T15:22:14.304Z"},{"date":"20/12/2013","time":"18:28:37","ip":"11.20.201.17","method":"GET","location":"/other","status":"200","datetime":"2013-12-20T17:28:37.304Z"},{"date":"14/1/2014","time":"19:47:19","ip":"11.20.201.17","method":"DELETE","location":"/job/3","status":"500","datetime":"2014-01-14T18:47:19.304Z"},{"date":"5/5/2014","time":"9:52:43","ip":"11.20.201.17","method":"OPTIONS","location":"/job/1/output","status":"200","datetime":"2014-05-05T07:52:43.304Z"},{"date":"11/5/2014","time":"16:6:35","ip":"11.20.201.17","method":"PUT","location":"/prev","status":"401","datetime":"2014-05-11T14:06:35.304Z"},{"date":"26/5/2014","time":"4:31:46","ip":"11.20.201.17","method":"POST","location":"/resource/edit","status":"200","datetime":"2014-05-26T02:31:46.304Z"},{"date":"6/6/2014","time":"1:22:7","ip":"11.20.201.17","method":"DELETE","location":"/job/1/output","status":"405","datetime":"2014-06-05T23:22:07.304Z"},{"date":"24/6/2014","time":"15:22:9","ip":"11.20.201.17","method":"POST","location":"/prev","status":"404","datetime":"2014-06-24T13:22:09.304Z"},{"date":"25/6/2014","time":"7:32:44","ip":"11.20.201.17","method":"POST","location":"/job/2","status":"200","datetime":"2014-06-25T05:32:44.304Z"},{"date":"30/6/2014","time":"22:16:33","ip":"11.20.201.17","method":"POST","location":"/resource/edit","status":"200","datetime":"2014-06-30T20:16:33.304Z"},{"date":"6/9/2014","time":"13:16:13","ip":"11.20.201.17","method":"POST","location":"/job/3","status":"201","datetime":"2014-09-06T11:16:13.304Z"},{"date":"21/9/2014","time":"7:44:52","ip":"11.20.201.17","method":"OPTIONS","location":"/first","status":"404","datetime":"2014-09-21T05:44:52.304Z"},{"date":"19/10/2014","time":"12:1:58","ip":"11.20.201.17","method":"OPTIONS","location":"/","status":"200","datetime":"2014-10-19T10:01:58.304Z"},{"date":"1/11/2014","time":"11:46:35","ip":"11.20.201.17","method":"GET","location":"/job/3","status":"403","datetime":"2014-11-01T10:46:35.304Z"},{"date":"4/11/2014","time":"5:20:56","ip":"11.20.201.17","method":"GET","location":"/other","status":"308","datetime":"2014-11-04T04:20:56.304Z"},{"date":"7/11/2014","time":"5:17:2","ip":"11.20.201.17","method":"GET","location":"/other","status":"200","datetime":"2014-11-07T04:17:02.304Z"},{"date":"11/12/2014","time":"3:44:45","ip":"11.20.201.17","method":"POST","location":"/job/2","status":"405","datetime":"2014-12-11T02:44:45.304Z"},{"date":"15/12/2014","time":"0:6:8","ip":"11.20.201.17","method":"DELETE","location":"/job/1","status":"405","datetime":"2014-12-14T23:06:08.304Z"},{"date":"13/1/2015","time":"19:28:51","ip":"11.20.201.17","method":"GET","location":"/job/3","status":"404","datetime":"2015-01-13T18:28:51.304Z"},{"date":"18/1/2015","time":"22:56:1","ip":"11.20.201.17","method":"POST","location":"/resource/edit","status":"403","datetime":"2015-01-18T21:56:01.304Z"},{"date":"10/2/2015","time":"11:14:19","ip":"11.20.201.17","method":"POST","location":"/job/1/output","status":"202","datetime":"2015-02-10T10:14:19.304Z"},{"date":"14/3/2015","time":"8:13:50","ip":"11.20.201.17","method":"DELETE","location":"/job/3","status":"204","datetime":"2015-03-14T07:13:50.304Z"},{"date":"17/3/2015","time":"23:45:28","ip":"11.20.201.17","method":"POST","location":"/job/3","status":"405","datetime":"2015-03-17T22:45:28.304Z"},{"date":"21/3/2015","time":"19:4:14","ip":"11.20.201.17","method":"GET","location":"/job","status":"308","datetime":"2015-03-21T18:04:14.304Z"},{"date":"26/3/2015","time":"22:44:29","ip":"11.20.201.17","method":"GET","location":"/resource2","status":"403","datetime":"2015-03-26T21:44:29.304Z"},{"date":"3/6/2015","time":"21:0:13","ip":"11.20.201.17","method":"PUT","location":"/resource2","status":"405","datetime":"2015-06-03T19:00:13.304Z"},{"date":"15/6/2015","time":"9:50:19","ip":"11.20.201.17","method":"GET","location":"/resource","status":"303","datetime":"2015-06-15T07:50:19.304Z"},{"date":"19/7/2015","time":"21:44:34","ip":"11.20.201.17","method":"PUT","location":"/job","status":"403","datetime":"2015-07-19T19:44:34.304Z"},{"date":"26/7/2015","time":"4:16:54","ip":"11.20.201.17","method":"POST","location":"/prev","status":"200","datetime":"2015-07-26T02:16:54.304Z"},{"date":"15/8/2015","time":"4:1:52","ip":"11.20.201.17","method":"OPTIONS","location":"/job/2","status":"404","datetime":"2015-08-15T02:01:52.304Z"},{"date":"2/9/2015","time":"8:41:2","ip":"11.20.201.17","method":"GET","location":"/job/2/output","status":"301","datetime":"2015-09-02T06:41:02.304Z"},{"date":"29/9/2015","time":"14:25:45","ip":"11.20.201.17","method":"GET","location":"/resource2","status":"500","datetime":"2015-09-29T12:25:45.304Z"},{"date":"8/10/2015","time":"0:15:37","ip":"11.20.201.17","method":"POST","location":"/job/2/output","status":"405","datetime":"2015-10-07T22:15:37.304Z"},{"date":"3/11/2015","time":"16:39:12","ip":"11.20.201.17","method":"DELETE","location":"/last","status":"401","datetime":"2015-11-03T15:39:12.304Z"},{"date":"19/11/2015","time":"9:21:16","ip":"11.20.201.17","method":"GET","location":"/last","status":"307","datetime":"2015-11-19T08:21:16.304Z"},{"date":"26/11/2015","time":"17:25:32","ip":"11.20.201.17","method":"PUT","location":"/job/1","status":"500","datetime":"2015-11-26T16:25:32.304Z"},{"date":"17/12/2015","time":"1:45:57","ip":"11.20.201.17","method":"DELETE","location":"/job/2","status":"405","datetime":"2015-12-17T00:45:57.304Z"},{"date":"19/12/2015","time":"13:48:28","ip":"11.20.201.17","method":"GET","location":"/resource1","status":"500","datetime":"2015-12-19T12:48:28.304Z"},{"date":"20/2/2016","time":"23:23:50","ip":"11.20.201.17","method":"DELETE","location":"/resource2","status":"403","datetime":"2016-02-20T22:23:50.304Z"},{"date":"2/3/2016","time":"1:26:31","ip":"11.20.201.17","method":"GET","location":"/next","status":"308","datetime":"2016-03-02T00:26:31.304Z"},{"date":"13/3/2016","time":"5:20:30","ip":"11.20.201.17","method":"PUT","location":"/job/2/output","status":"200","datetime":"2016-03-13T04:20:30.304Z"},{"date":"22/3/2016","time":"17:55:28","ip":"11.20.201.17","method":"PUT","location":"/job","status":"400","datetime":"2016-03-22T16:55:28.304Z"},{"date":"27/5/2016","time":"20:46:37","ip":"11.20.201.17","method":"GET","location":"/resource","status":"308","datetime":"2016-05-27T18:46:37.304Z"},{"date":"28/5/2016","time":"6:47:21","ip":"11.20.201.17","method":"GET","location":"/job/1","status":"404","datetime":"2016-05-28T04:47:21.304Z"},{"date":"12/6/2016","time":"13:2:43","ip":"11.20.201.17","method":"POST","location":"/first","status":"404","datetime":"2016-06-12T11:02:43.304Z"},{"date":"7/7/2016","time":"18:24:31","ip":"11.20.201.17","method":"GET","location":"/resource1","status":"500","datetime":"2016-07-07T16:24:31.304Z"},{"date":"31/7/2016","time":"1:47:12","ip":"11.20.201.17","method":"OPTIONS","location":"/job/2/output","status":"200","datetime":"2016-07-30T23:47:12.304Z"},{"date":"11/8/2016","time":"22:40:37","ip":"11.20.201.17","method":"PUT","location":"/last","status":"200","datetime":"2016-08-11T20:40:37.304Z"},{"date":"16/8/2016","time":"12:2:28","ip":"11.20.201.17","method":"GET","location":"/resource1","status":"403","datetime":"2016-08-16T10:02:28.304Z"},{"date":"22/8/2016","time":"9:59:0","ip":"11.20.201.17","method":"DELETE","location":"/resource1","status":"405","datetime":"2016-08-22T07:59:00.304Z"},{"date":"28/8/2016","time":"15:29:54","ip":"11.20.201.17","method":"DELETE","location":"/resource2","status":"401","datetime":"2016-08-28T13:29:54.304Z"},{"date":"31/8/2016","time":"21:30:36","ip":"11.20.201.17","method":"GET","location":"/next","status":"303","datetime":"2016-08-31T19:30:36.304Z"},{"date":"9/9/2016","time":"3:59:41","ip":"11.20.201.17","method":"GET","location":"/job/3","status":"308","datetime":"2016-09-09T01:59:41.304Z"},{"date":"23/9/2016","time":"6:54:10","ip":"11.20.201.17","method":"DELETE","location":"/job","status":"204","datetime":"2016-09-23T04:54:10.304Z"},{"date":"30/10/2016","time":"12:21:20","ip":"11.20.201.17","method":"DELETE","location":"/job/3","status":"401","datetime":"2016-10-30T11:21:20.304Z"},{"date":"20/11/2016","time":"0:56:23","ip":"11.20.201.17","method":"OPTIONS","location":"/first","status":"404","datetime":"2016-11-19T23:56:23.304Z"},{"date":"10/1/2017","time":"8:41:42","ip":"11.20.201.17","method":"PUT","location":"/job/2","status":"400","datetime":"2017-01-10T07:41:42.304Z"},{"date":"23/1/2017","time":"8:8:58","ip":"11.20.201.17","method":"POST","location":"/last","status":"202","datetime":"2017-01-23T07:08:58.304Z"},{"date":"23/2/2017","time":"6:48:12","ip":"11.20.201.17","method":"DELETE","location":"/resource1","status":"204","datetime":"2017-02-23T05:48:12.304Z"},{"date":"27/2/2017","time":"20:50:42","ip":"11.20.201.17","method":"GET","location":"/other","status":"308","datetime":"2017-02-27T19:50:42.304Z"},{"date":"27/3/2017","time":"16:6:31","ip":"11.20.201.17","method":"PUT","location":"/job/1/output","status":"403","datetime":"2017-03-27T14:06:31.304Z"},{"date":"2/4/2017","time":"19:5:24","ip":"11.20.201.17","method":"OPTIONS","location":"/other","status":"404","datetime":"2017-04-02T17:05:24.304Z"},{"date":"6/4/2017","time":"20:26:47","ip":"11.20.201.17","method":"GET","location":"/other","status":"403","datetime":"2017-04-06T18:26:47.304Z"},{"date":"8/6/2017","time":"17:46:2","ip":"11.20.201.17","method":"PUT","location":"/job/3","status":"201","datetime":"2017-06-08T15:46:02.304Z"},{"date":"12/6/2017","time":"10:23:28","ip":"11.20.201.17","method":"POST","location":"/job/2","status":"201","datetime":"2017-06-12T08:23:28.304Z"},{"date":"15/6/2017","time":"0:10:10","ip":"11.20.201.17","method":"PUT","location":"/resource2","status":"500","datetime":"2017-06-14T22:10:10.304Z"},{"date":"26/6/2017","time":"6:15:55","ip":"11.20.201.17","method":"OPTIONS","location":"/job","status":"404","datetime":"2017-06-26T04:15:55.304Z"},{"date":"30/7/2017","time":"0:1:30","ip":"11.20.201.17","method":"OPTIONS","location":"/resource","status":"200","datetime":"2017-07-29T22:01:30.304Z"},{"date":"21/8/2017","time":"23:27:54","ip":"11.20.201.17","method":"POST","location":"/prev","status":"400","datetime":"2017-08-21T21:27:54.304Z"},{"date":"9/9/2017","time":"10:47:31","ip":"11.20.201.17","method":"DELETE","location":"/resource","status":"400","datetime":"2017-09-09T08:47:31.304Z"},{"date":"12/9/2017","time":"7:15:52","ip":"11.20.201.17","method":"POST","location":"/job/3","status":"404","datetime":"2017-09-12T05:15:52.304Z"},{"date":"27/9/2017","time":"20:23:58","ip":"11.20.201.17","method":"PUT","location":"/last","status":"409","datetime":"2017-09-27T18:23:58.304Z"},{"date":"19/10/2017","time":"4:58:19","ip":"11.20.201.17","method":"GET","location":"/job/1","status":"200","datetime":"2017-10-19T02:58:19.304Z"},{"date":"23/10/2017","time":"11:42:35","ip":"11.20.201.17","method":"POST","location":"/last","status":"403","datetime":"2017-10-23T09:42:35.304Z"},{"date":"4/12/2017","time":"12:57:24","ip":"11.20.201.17","method":"DELETE","location":"/job/3","status":"500","datetime":"2017-12-04T11:57:24.304Z"},{"date":"9/12/2017","time":"15:56:21","ip":"11.20.201.17","method":"POST","location":"/last","status":"201","datetime":"2017-12-09T14:56:21.304Z"},{"date":"6/1/2018","time":"10:40:48","ip":"11.20.201.17","method":"POST","location":"/first","status":"405","datetime":"2018-01-06T09:40:48.304Z"},{"date":"7/1/2018","time":"2:42:31","ip":"11.20.201.17","method":"OPTIONS","location":"/job/1/output","status":"200","datetime":"2018-01-07T01:42:31.304Z"},{"date":"1/2/2018","time":"1:49:1","ip":"11.20.201.17","method":"OPTIONS","location":"/job","status":"404","datetime":"2018-02-01T00:49:01.304Z"}],"233.63.135.22":[{"date":"12/1/2012","time":"22:15:48","ip":"233.63.135.22","method":"GET","location":"/other","status":"200","datetime":"2012-01-12T21:15:48.304Z"},{"date":"24/1/2012","time":"11:6:51","ip":"233.63.135.22","method":"OPTIONS","location":"/first","status":"404","datetime":"2012-01-24T10:06:51.304Z"},{"date":"15/2/2012","time":"3:46:44","ip":"233.63.135.22","method":"PUT","location":"/resource","status":"405","datetime":"2012-02-15T02:46:44.304Z"},{"date":"5/3/2012","time":"10:37:33","ip":"233.63.135.22","method":"POST","location":"/first","status":"403","datetime":"2012-03-05T09:37:33.304Z"},{"date":"16/3/2012","time":"0:57:13","ip":"233.63.135.22","method":"OPTIONS","location":"/","status":"404","datetime":"2012-03-15T23:57:13.304Z"},{"date":"12/4/2012","time":"1:29:42","ip":"233.63.135.22","method":"POST","location":"/job/2/output","status":"401","datetime":"2012-04-11T23:29:42.304Z"},{"date":"29/5/2012","time":"4:20:6","ip":"233.63.135.22","method":"DELETE","location":"/job/1/output","status":"405","datetime":"2012-05-29T02:20:06.304Z"},{"date":"17/6/2012","time":"4:56:8","ip":"233.63.135.22","method":"OPTIONS","location":"/prev","status":"200","datetime":"2012-06-17T02:56:08.304Z"},{"date":"4/7/2012","time":"23:7:12","ip":"233.63.135.22","method":"DELETE","location":"/next","status":"400","datetime":"2012-07-04T21:07:12.304Z"},{"date":"7/8/2012","time":"19:53:7","ip":"233.63.135.22","method":"DELETE","location":"/resource1","status":"400","datetime":"2012-08-07T17:53:07.304Z"},{"date":"12/8/2012","time":"9:35:5","ip":"233.63.135.22","method":"OPTIONS","location":"/next","status":"200","datetime":"2012-08-12T07:35:05.304Z"},{"date":"13/8/2012","time":"22:21:2","ip":"233.63.135.22","method":"DELETE","location":"/other","status":"204","datetime":"2012-08-13T20:21:02.304Z"},{"date":"30/8/2012","time":"9:56:9","ip":"233.63.135.22","method":"GET","location":"/","status":"200","datetime":"2012-08-30T07:56:09.304Z"},{"date":"17/9/2012","time":"4:46:2","ip":"233.63.135.22","method":"PUT","location":"/other","status":"200","datetime":"2012-09-17T02:46:02.304Z"},{"date":"25/12/2012","time":"19:45:10","ip":"233.63.135.22","method":"POST","location":"/","status":"404","datetime":"2012-12-25T18:45:10.304Z"},{"date":"7/1/2013","time":"0:12:36","ip":"233.63.135.22","method":"DELETE","location":"/job/1","status":"403","datetime":"2013-01-06T23:12:36.304Z"},{"date":"11/2/2013","time":"4:27:7","ip":"233.63.135.22","method":"GET","location":"/other","status":"301","datetime":"2013-02-11T03:27:07.304Z"},{"date":"17/2/2013","time":"17:26:27","ip":"233.63.135.22","method":"GET","location":"/resource2","status":"404","datetime":"2013-02-17T16:26:27.304Z"},{"date":"18/2/2013","time":"1:6:7","ip":"233.63.135.22","method":"POST","location":"/job/3","status":"200","datetime":"2013-02-18T00:06:07.304Z"},{"date":"8/3/2013","time":"8:25:18","ip":"233.63.135.22","method":"OPTIONS","location":"/last","status":"404","datetime":"2013-03-08T07:25:18.304Z"},{"date":"18/3/2013","time":"15:23:48","ip":"233.63.135.22","method":"PUT","location":"/first","status":"403","datetime":"2013-03-18T14:23:48.304Z"},{"date":"28/3/2013","time":"19:2:56","ip":"233.63.135.22","method":"POST","location":"/first","status":"405","datetime":"2013-03-28T18:02:56.304Z"},{"date":"10/4/2013","time":"3:6:30","ip":"233.63.135.22","method":"GET","location":"/job/3","status":"303","datetime":"2013-04-10T01:06:30.304Z"},{"date":"4/7/2013","time":"20:34:50","ip":"233.63.135.22","method":"GET","location":"/resource1","status":"404","datetime":"2013-07-04T18:34:50.304Z"},{"date":"9/7/2013","time":"8:34:49","ip":"233.63.135.22","method":"DELETE","location":"/job/1","status":"404","datetime":"2013-07-09T06:34:49.304Z"},{"date":"15/9/2013","time":"8:21:9","ip":"233.63.135.22","method":"OPTIONS","location":"/resource1","status":"404","datetime":"2013-09-15T06:21:09.304Z"},{"date":"29/9/2013","time":"17:51:52","ip":"233.63.135.22","method":"OPTIONS","location":"/job/1","status":"200","datetime":"2013-09-29T15:51:52.304Z"},{"date":"22/10/2013","time":"2:17:26","ip":"233.63.135.22","method":"OPTIONS","location":"/resource1","status":"200","datetime":"2013-10-22T00:17:26.304Z"},{"date":"28/11/2013","time":"18:56:45","ip":"233.63.135.22","method":"GET","location":"/resource1","status":"308","datetime":"2013-11-28T17:56:45.304Z"},{"date":"1/12/2013","time":"4:11:39","ip":"233.63.135.22","method":"DELETE","location":"/job/2/output","status":"404","datetime":"2013-12-01T03:11:39.304Z"},{"date":"27/1/2014","time":"6:32:3","ip":"233.63.135.22","method":"PUT","location":"/job/2/output","status":"405","datetime":"2014-01-27T05:32:03.304Z"},{"date":"12/2/2014","time":"7:20:24","ip":"233.63.135.22","method":"OPTIONS","location":"/job/2/output","status":"200","datetime":"2014-02-12T06:20:24.304Z"},{"date":"20/2/2014","time":"4:58:53","ip":"233.63.135.22","method":"DELETE","location":"/first","status":"401","datetime":"2014-02-20T03:58:53.304Z"},{"date":"3/5/2014","time":"7:2:40","ip":"233.63.135.22","method":"DELETE","location":"/resource/edit","status":"401","datetime":"2014-05-03T05:02:40.304Z"},{"date":"15/5/2014","time":"0:2:9","ip":"233.63.135.22","method":"GET","location":"/last","status":"404","datetime":"2014-05-14T22:02:09.304Z"},{"date":"26/5/2014","time":"3:24:33","ip":"233.63.135.22","method":"OPTIONS","location":"/job/3","status":"200","datetime":"2014-05-26T01:24:33.304Z"},{"date":"15/8/2014","time":"8:30:41","ip":"233.63.135.22","method":"GET","location":"/last","status":"404","datetime":"2014-08-15T06:30:41.304Z"},{"date":"6/9/2014","time":"5:52:22","ip":"233.63.135.22","method":"POST","location":"/resource2","status":"500","datetime":"2014-09-06T03:52:22.304Z"},{"date":"14/9/2014","time":"3:30:44","ip":"233.63.135.22","method":"OPTIONS","location":"/job/3","status":"404","datetime":"2014-09-14T01:30:44.304Z"},{"date":"22/9/2014","time":"13:3:20","ip":"233.63.135.22","method":"GET","location":"/job/1","status":"404","datetime":"2014-09-22T11:03:20.304Z"},{"date":"11/10/2014","time":"9:1:18","ip":"233.63.135.22","method":"OPTIONS","location":"/job","status":"404","datetime":"2014-10-11T07:01:18.304Z"},{"date":"29/10/2014","time":"9:44:50","ip":"233.63.135.22","method":"GET","location":"/job/2/output","status":"401","datetime":"2014-10-29T08:44:50.304Z"},{"date":"31/12/2014","time":"9:40:25","ip":"233.63.135.22","method":"PUT","location":"/job/2/output","status":"405","datetime":"2014-12-31T08:40:25.304Z"},{"date":"1/1/2015","time":"15:11:28","ip":"233.63.135.22","method":"DELETE","location":"/job/2/output","status":"204","datetime":"2015-01-01T14:11:28.304Z"},{"date":"3/2/2015","time":"16:14:21","ip":"233.63.135.22","method":"POST","location":"/next","status":"201","datetime":"2015-02-03T15:14:21.304Z"},{"date":"18/2/2015","time":"23:0:28","ip":"233.63.135.22","method":"DELETE","location":"/job/1/output","status":"401","datetime":"2015-02-18T22:00:28.304Z"},{"date":"25/2/2015","time":"17:18:24","ip":"233.63.135.22","method":"OPTIONS","location":"/job/3","status":"404","datetime":"2015-02-25T16:18:24.304Z"},{"date":"31/3/2015","time":"0:0:21","ip":"233.63.135.22","method":"PUT","location":"/resource/edit","status":"403","datetime":"2015-03-30T22:00:21.304Z"},{"date":"5/4/2015","time":"5:38:37","ip":"233.63.135.22","method":"OPTIONS","location":"/next","status":"200","datetime":"2015-04-05T03:38:37.304Z"},{"date":"24/4/2015","time":"4:39:58","ip":"233.63.135.22","method":"GET","location":"/job/2/output","status":"500","datetime":"2015-04-24T02:39:58.304Z"},{"date":"25/4/2015","time":"12:31:41","ip":"233.63.135.22","method":"PUT","location":"/other","status":"400","datetime":"2015-04-25T10:31:41.304Z"},{"date":"30/5/2015","time":"14:15:14","ip":"233.63.135.22","method":"POST","location":"/","status":"202","datetime":"2015-05-30T12:15:14.304Z"},{"date":"9/10/2015","time":"6:37:35","ip":"233.63.135.22","method":"DELETE","location":"/job/1","status":"400","datetime":"2015-10-09T04:37:35.304Z"},{"date":"14/11/2015","time":"7:50:44","ip":"233.63.135.22","method":"POST","location":"/resource2","status":"401","datetime":"2015-11-14T06:50:44.304Z"},{"date":"20/11/2015","time":"2:43:17","ip":"233.63.135.22","method":"PUT","location":"/other","status":"405","datetime":"2015-11-20T01:43:17.304Z"},{"date":"28/12/2015","time":"12:11:12","ip":"233.63.135.22","method":"DELETE","location":"/next","status":"403","datetime":"2015-12-28T11:11:12.304Z"},{"date":"29/12/2015","time":"1:50:45","ip":"233.63.135.22","method":"DELETE","location":"/job","status":"404","datetime":"2015-12-29T00:50:45.304Z"},{"date":"30/12/2015","time":"4:22:31","ip":"233.63.135.22","method":"POST","location":"/last","status":"200","datetime":"2015-12-30T03:22:31.304Z"},{"date":"17/1/2016","time":"15:46:33","ip":"233.63.135.22","method":"PUT","location":"/job","status":"401","datetime":"2016-01-17T14:46:33.304Z"},{"date":"29/1/2016","time":"19:56:37","ip":"233.63.135.22","method":"GET","location":"/job/1/output","status":"403","datetime":"2016-01-29T18:56:37.304Z"},{"date":"28/3/2016","time":"16:20:34","ip":"233.63.135.22","method":"GET","location":"/job","status":"308","datetime":"2016-03-28T14:20:34.304Z"},{"date":"30/3/2016","time":"7:59:41","ip":"233.63.135.22","method":"GET","location":"/next","status":"500","datetime":"2016-03-30T05:59:41.304Z"},{"date":"26/4/2016","time":"13:1:23","ip":"233.63.135.22","method":"DELETE","location":"/job","status":"403","datetime":"2016-04-26T11:01:23.304Z"},{"date":"19/7/2016","time":"10:25:1","ip":"233.63.135.22","method":"DELETE","location":"/resource2","status":"405","datetime":"2016-07-19T08:25:01.304Z"},{"date":"29/7/2016","time":"6:46:22","ip":"233.63.135.22","method":"PUT","location":"/resource/edit","status":"401","datetime":"2016-07-29T04:46:22.304Z"},{"date":"13/9/2016","time":"3:3:24","ip":"233.63.135.22","method":"DELETE","location":"/job/3","status":"400","datetime":"2016-09-13T01:03:24.304Z"},{"date":"26/9/2016","time":"18:0:21","ip":"233.63.135.22","method":"GET","location":"/job","status":"307","datetime":"2016-09-26T16:00:21.304Z"},{"date":"3/11/2016","time":"1:50:43","ip":"233.63.135.22","method":"GET","location":"/job/3","status":"404","datetime":"2016-11-03T00:50:43.304Z"},{"date":"7/1/2017","time":"4:58:13","ip":"233.63.135.22","method":"PUT","location":"/resource2","status":"401","datetime":"2017-01-07T03:58:13.304Z"},{"date":"25/1/2017","time":"12:4:31","ip":"233.63.135.22","method":"POST","location":"/job/1","status":"202","datetime":"2017-01-25T11:04:31.304Z"},{"date":"7/2/2017","time":"6:35:1","ip":"233.63.135.22","method":"POST","location":"/resource/edit","status":"405","datetime":"2017-02-07T05:35:01.304Z"},{"date":"26/4/2017","time":"12:36:37","ip":"233.63.135.22","method":"PUT","location":"/job/1/output","status":"405","datetime":"2017-04-26T10:36:37.304Z"},{"date":"29/4/2017","time":"23:35:46","ip":"233.63.135.22","method":"PUT","location":"/prev","status":"401","datetime":"2017-04-29T21:35:46.304Z"},{"date":"2/5/2017","time":"13:50:58","ip":"233.63.135.22","method":"PUT","location":"/resource","status":"405","datetime":"2017-05-02T11:50:58.304Z"},{"date":"3/5/2017","time":"10:9:3","ip":"233.63.135.22","method":"OPTIONS","location":"/job","status":"200","datetime":"2017-05-03T08:09:03.304Z"},{"date":"14/5/2017","time":"9:15:56","ip":"233.63.135.22","method":"POST","location":"/job/3","status":"405","datetime":"2017-05-14T07:15:56.304Z"},{"date":"19/5/2017","time":"6:2:3","ip":"233.63.135.22","method":"OPTIONS","location":"/job/3","status":"404","datetime":"2017-05-19T04:02:03.304Z"},{"date":"29/5/2017","time":"22:6:14","ip":"233.63.135.22","method":"DELETE","location":"/resource2","status":"400","datetime":"2017-05-29T20:06:14.304Z"},{"date":"30/5/2017","time":"9:58:15","ip":"233.63.135.22","method":"OPTIONS","location":"/job","status":"200","datetime":"2017-05-30T07:58:15.304Z"},{"date":"5/8/2017","time":"1:15:2","ip":"233.63.135.22","method":"GET","location":"/resource/edit","status":"200","datetime":"2017-08-04T23:15:02.304Z"},{"date":"13/8/2017","time":"20:58:59","ip":"233.63.135.22","method":"OPTIONS","location":"/resource1","status":"404","datetime":"2017-08-13T18:58:59.304Z"},{"date":"22/9/2017","time":"19:0:44","ip":"233.63.135.22","method":"POST","location":"/job/3","status":"405","datetime":"2017-09-22T17:00:44.304Z"},{"date":"23/11/2017","time":"11:36:34","ip":"233.63.135.22","method":"OPTIONS","location":"/resource","status":"404","datetime":"2017-11-23T10:36:34.304Z"},{"date":"6/12/2017","time":"6:1:27","ip":"233.63.135.22","method":"POST","location":"/resource","status":"403","datetime":"2017-12-06T05:01:27.304Z"},{"date":"14/12/2017","time":"4:55:22","ip":"233.63.135.22","method":"GET","location":"/resource/edit","status":"404","datetime":"2017-12-14T03:55:22.304Z"},{"date":"16/12/2017","time":"7:34:58","ip":"233.63.135.22","method":"PUT","location":"/job/1","status":"409","datetime":"2017-12-16T06:34:58.304Z"},{"date":"18/12/2017","time":"2:23:34","ip":"233.63.135.22","method":"PUT","location":"/first","status":"405","datetime":"2017-12-18T01:23:34.304Z"}],"165.211.33.194":[{"date":"6/1/2012","time":"11:54:48","ip":"165.211.33.194","method":"POST","location":"/prev","status":"400","datetime":"2012-01-06T10:54:48.304Z"},{"date":"25/1/2012","time":"21:14:16","ip":"165.211.33.194","method":"GET","location":"/next","status":"308","datetime":"2012-01-25T20:14:16.304Z"},{"date":"7/2/2012","time":"4:53:31","ip":"165.211.33.194","method":"GET","location":"/job/1","status":"307","datetime":"2012-02-07T03:53:31.304Z"},{"date":"11/3/2012","time":"13:50:3","ip":"165.211.33.194","method":"DELETE","location":"/next","status":"500","datetime":"2012-03-11T12:50:03.304Z"},{"date":"16/3/2012","time":"11:33:14","ip":"165.211.33.194","method":"POST","location":"/job/1/output","status":"500","datetime":"2012-03-16T10:33:14.304Z"},{"date":"10/4/2012","time":"10:21:22","ip":"165.211.33.194","method":"PUT","location":"/job/1/output","status":"403","datetime":"2012-04-10T08:21:22.304Z"},{"date":"23/4/2012","time":"0:33:53","ip":"165.211.33.194","method":"OPTIONS","location":"/job","status":"200","datetime":"2012-04-22T22:33:53.304Z"},{"date":"5/5/2012","time":"1:35:17","ip":"165.211.33.194","method":"PUT","location":"/job","status":"405","datetime":"2012-05-04T23:35:17.304Z"},{"date":"20/5/2012","time":"7:10:13","ip":"165.211.33.194","method":"PUT","location":"/job/2","status":"500","datetime":"2012-05-20T05:10:13.304Z"},{"date":"11/6/2012","time":"2:22:58","ip":"165.211.33.194","method":"POST","location":"/resource/edit","status":"401","datetime":"2012-06-11T00:22:58.304Z"},{"date":"26/7/2012","time":"1:26:41","ip":"165.211.33.194","method":"GET","location":"/job/3","status":"404","datetime":"2012-07-25T23:26:41.304Z"},{"date":"3/9/2012","time":"9:8:31","ip":"165.211.33.194","method":"DELETE","location":"/job/1/output","status":"403","datetime":"2012-09-03T07:08:31.304Z"},{"date":"12/10/2012","time":"4:18:10","ip":"165.211.33.194","method":"DELETE","location":"/other","status":"204","datetime":"2012-10-12T02:18:10.304Z"},{"date":"18/10/2012","time":"12:49:2","ip":"165.211.33.194","method":"POST","location":"/resource/edit","status":"202","datetime":"2012-10-18T10:49:02.304Z"},{"date":"6/11/2012","time":"19:35:53","ip":"165.211.33.194","method":"PUT","location":"/job/3","status":"200","datetime":"2012-11-06T18:35:53.304Z"},{"date":"10/11/2012","time":"4:3:23","ip":"165.211.33.194","method":"OPTIONS","location":"/job/1/output","status":"200","datetime":"2012-11-10T03:03:23.304Z"},{"date":"3/12/2012","time":"7:57:16","ip":"165.211.33.194","method":"POST","location":"/job/2","status":"200","datetime":"2012-12-03T06:57:16.304Z"},{"date":"15/1/2013","time":"7:0:7","ip":"165.211.33.194","method":"OPTIONS","location":"/prev","status":"200","datetime":"2013-01-15T06:00:07.304Z"},{"date":"20/1/2013","time":"2:57:18","ip":"165.211.33.194","method":"DELETE","location":"/job/2/output","status":"401","datetime":"2013-01-20T01:57:18.304Z"},{"date":"13/3/2013","time":"4:19:0","ip":"165.211.33.194","method":"POST","location":"/job/2","status":"403","datetime":"2013-03-13T03:19:00.304Z"},{"date":"14/3/2013","time":"16:47:54","ip":"165.211.33.194","method":"DELETE","location":"/prev","status":"403","datetime":"2013-03-14T15:47:54.304Z"},{"date":"2/4/2013","time":"11:33:31","ip":"165.211.33.194","method":"OPTIONS","location":"/job/1/output","status":"200","datetime":"2013-04-02T09:33:31.304Z"},{"date":"19/4/2013","time":"4:8:14","ip":"165.211.33.194","method":"DELETE","location":"/","status":"500","datetime":"2013-04-19T02:08:14.304Z"},{"date":"28/4/2013","time":"0:55:56","ip":"165.211.33.194","method":"GET","location":"/","status":"401","datetime":"2013-04-27T22:55:56.304Z"},{"date":"9/5/2013","time":"10:25:49","ip":"165.211.33.194","method":"DELETE","location":"/last","status":"405","datetime":"2013-05-09T08:25:49.304Z"},{"date":"12/5/2013","time":"1:52:50","ip":"165.211.33.194","method":"DELETE","location":"/job/1","status":"403","datetime":"2013-05-11T23:52:50.304Z"},{"date":"2/6/2013","time":"23:33:10","ip":"165.211.33.194","method":"POST","location":"/resource1","status":"400","datetime":"2013-06-02T21:33:10.304Z"},{"date":"10/7/2013","time":"4:46:51","ip":"165.211.33.194","method":"POST","location":"/resource","status":"403","datetime":"2013-07-10T02:46:51.304Z"},{"date":"21/7/2013","time":"4:14:26","ip":"165.211.33.194","method":"PUT","location":"/job/2/output","status":"403","datetime":"2013-07-21T02:14:26.304Z"},{"date":"23/7/2013","time":"17:13:24","ip":"165.211.33.194","method":"GET","location":"/resource2","status":"403","datetime":"2013-07-23T15:13:24.304Z"},{"date":"28/7/2013","time":"2:18:34","ip":"165.211.33.194","method":"OPTIONS","location":"/next","status":"404","datetime":"2013-07-28T00:18:34.304Z"},{"date":"12/9/2013","time":"11:2:48","ip":"165.211.33.194","method":"DELETE","location":"/job/3","status":"400","datetime":"2013-09-12T09:02:48.304Z"},{"date":"12/9/2013","time":"21:57:21","ip":"165.211.33.194","method":"PUT","location":"/other","status":"400","datetime":"2013-09-12T19:57:21.304Z"},{"date":"3/10/2013","time":"18:23:23","ip":"165.211.33.194","method":"GET","location":"/next","status":"403","datetime":"2013-10-03T16:23:23.304Z"},{"date":"18/10/2013","time":"13:43:30","ip":"165.211.33.194","method":"POST","location":"/job/2/output","status":"400","datetime":"2013-10-18T11:43:30.304Z"},{"date":"22/10/2013","time":"12:3:9","ip":"165.211.33.194","method":"DELETE","location":"/resource","status":"400","datetime":"2013-10-22T10:03:09.304Z"},{"date":"12/11/2013","time":"18:42:52","ip":"165.211.33.194","method":"DELETE","location":"/resource","status":"401","datetime":"2013-11-12T17:42:52.304Z"},{"date":"20/11/2013","time":"12:36:3","ip":"165.211.33.194","method":"OPTIONS","location":"/resource1","status":"200","datetime":"2013-11-20T11:36:03.304Z"},{"date":"8/12/2013","time":"14:13:9","ip":"165.211.33.194","method":"GET","location":"/resource","status":"303","datetime":"2013-12-08T13:13:09.304Z"},{"date":"10/2/2014","time":"7:21:7","ip":"165.211.33.194","method":"PUT","location":"/job/3","status":"200","datetime":"2014-02-10T06:21:07.304Z"},{"date":"16/4/2014","time":"2:4:2","ip":"165.211.33.194","method":"DELETE","location":"/resource/edit","status":"204","datetime":"2014-04-16T00:04:02.304Z"},{"date":"25/5/2014","time":"11:20:58","ip":"165.211.33.194","method":"PUT","location":"/job/2","status":"405","datetime":"2014-05-25T09:20:58.304Z"},{"date":"14/6/2014","time":"3:12:13","ip":"165.211.33.194","method":"PUT","location":"/job/1","status":"403","datetime":"2014-06-14T01:12:13.304Z"},{"date":"25/6/2014","time":"23:26:15","ip":"165.211.33.194","method":"POST","location":"/resource2","status":"202","datetime":"2014-06-25T21:26:15.304Z"},{"date":"19/10/2014","time":"17:1:40","ip":"165.211.33.194","method":"PUT","location":"/other","status":"201","datetime":"2014-10-19T15:01:40.304Z"},{"date":"14/11/2014","time":"11:31:22","ip":"165.211.33.194","method":"POST","location":"/job/3","status":"200","datetime":"2014-11-14T10:31:22.304Z"},{"date":"29/12/2014","time":"13:47:21","ip":"165.211.33.194","method":"GET","location":"/job","status":"500","datetime":"2014-12-29T12:47:21.304Z"},{"date":"13/1/2015","time":"19:11:51","ip":"165.211.33.194","method":"DELETE","location":"/resource","status":"403","datetime":"2015-01-13T18:11:51.304Z"},{"date":"19/2/2015","time":"11:42:11","ip":"165.211.33.194","method":"OPTIONS","location":"/resource1","status":"200","datetime":"2015-02-19T10:42:11.304Z"},{"date":"2/3/2015","time":"9:10:20","ip":"165.211.33.194","method":"DELETE","location":"/first","status":"204","datetime":"2015-03-02T08:10:20.304Z"},{"date":"15/5/2015","time":"4:43:45","ip":"165.211.33.194","method":"PUT","location":"/job/3","status":"405","datetime":"2015-05-15T02:43:45.304Z"},{"date":"10/6/2015","time":"18:46:22","ip":"165.211.33.194","method":"PUT","location":"/first","status":"400","datetime":"2015-06-10T16:46:22.304Z"},{"date":"20/6/2015","time":"9:9:40","ip":"165.211.33.194","method":"OPTIONS","location":"/other","status":"404","datetime":"2015-06-20T07:09:40.304Z"},{"date":"28/8/2015","time":"0:48:7","ip":"165.211.33.194","method":"PUT","location":"/last","status":"400","datetime":"2015-08-27T22:48:07.304Z"},{"date":"22/9/2015","time":"23:17:3","ip":"165.211.33.194","method":"GET","location":"/job/2","status":"401","datetime":"2015-09-22T21:17:03.304Z"},{"date":"26/9/2015","time":"23:0:3","ip":"165.211.33.194","method":"DELETE","location":"/job/2/output","status":"401","datetime":"2015-09-26T21:00:03.304Z"},{"date":"21/10/2015","time":"17:2:44","ip":"165.211.33.194","method":"GET","location":"/other","status":"308","datetime":"2015-10-21T15:02:44.304Z"},{"date":"9/11/2015","time":"16:19:30","ip":"165.211.33.194","method":"POST","location":"/job/1/output","status":"200","datetime":"2015-11-09T15:19:30.304Z"},{"date":"25/11/2015","time":"0:59:47","ip":"165.211.33.194","method":"GET","location":"/resource","status":"500","datetime":"2015-11-24T23:59:47.304Z"},{"date":"30/11/2015","time":"11:1:49","ip":"165.211.33.194","method":"POST","location":"/job","status":"200","datetime":"2015-11-30T10:01:49.304Z"},{"date":"1/12/2015","time":"20:10:40","ip":"165.211.33.194","method":"DELETE","location":"/job/3","status":"404","datetime":"2015-12-01T19:10:40.304Z"},{"date":"29/12/2015","time":"13:44:20","ip":"165.211.33.194","method":"OPTIONS","location":"/resource1","status":"200","datetime":"2015-12-29T12:44:20.304Z"},{"date":"3/1/2016","time":"21:29:7","ip":"165.211.33.194","method":"DELETE","location":"/job","status":"204","datetime":"2016-01-03T20:29:07.304Z"},{"date":"11/2/2016","time":"18:41:5","ip":"165.211.33.194","method":"OPTIONS","location":"/job/3","status":"200","datetime":"2016-02-11T17:41:05.304Z"},{"date":"16/2/2016","time":"19:25:3","ip":"165.211.33.194","method":"DELETE","location":"/resource/edit","status":"401","datetime":"2016-02-16T18:25:03.304Z"},{"date":"4/3/2016","time":"19:54:22","ip":"165.211.33.194","method":"GET","location":"/prev","status":"401","datetime":"2016-03-04T18:54:22.304Z"},{"date":"9/3/2016","time":"17:46:29","ip":"165.211.33.194","method":"DELETE","location":"/other","status":"405","datetime":"2016-03-09T16:46:29.304Z"},{"date":"9/4/2016","time":"5:22:45","ip":"165.211.33.194","method":"GET","location":"/job/3","status":"308","datetime":"2016-04-09T03:22:45.304Z"},{"date":"22/4/2016","time":"7:5:39","ip":"165.211.33.194","method":"POST","location":"/resource/edit","status":"201","datetime":"2016-04-22T05:05:39.304Z"},{"date":"30/4/2016","time":"18:39:59","ip":"165.211.33.194","method":"GET","location":"/last","status":"403","datetime":"2016-04-30T16:39:59.304Z"},{"date":"1/6/2016","time":"19:1:51","ip":"165.211.33.194","method":"PUT","location":"/job/3","status":"409","datetime":"2016-06-01T17:01:51.304Z"},{"date":"24/7/2016","time":"3:51:48","ip":"165.211.33.194","method":"POST","location":"/job/1/output","status":"404","datetime":"2016-07-24T01:51:48.304Z"},{"date":"31/7/2016","time":"0:6:41","ip":"165.211.33.194","method":"POST","location":"/job/2/output","status":"405","datetime":"2016-07-30T22:06:41.304Z"},{"date":"1/8/2016","time":"3:16:55","ip":"165.211.33.194","method":"PUT","location":"/job/1/output","status":"401","datetime":"2016-08-01T01:16:55.304Z"},{"date":"26/9/2016","time":"16:17:28","ip":"165.211.33.194","method":"POST","location":"/last","status":"403","datetime":"2016-09-26T14:17:28.304Z"},{"date":"15/10/2016","time":"0:30:12","ip":"165.211.33.194","method":"OPTIONS","location":"/resource/edit","status":"404","datetime":"2016-10-14T22:30:12.304Z"},{"date":"13/11/2016","time":"2:20:34","ip":"165.211.33.194","method":"PUT","location":"/resource1","status":"200","datetime":"2016-11-13T01:20:34.304Z"},{"date":"29/11/2016","time":"19:47:49","ip":"165.211.33.194","method":"DELETE","location":"/first","status":"500","datetime":"2016-11-29T18:47:49.304Z"},{"date":"14/12/2016","time":"9:14:46","ip":"165.211.33.194","method":"PUT","location":"/next","status":"200","datetime":"2016-12-14T08:14:46.304Z"},{"date":"1/2/2017","time":"8:55:1","ip":"165.211.33.194","method":"PUT","location":"/resource","status":"400","datetime":"2017-02-01T07:55:01.304Z"},{"date":"6/2/2017","time":"0:49:26","ip":"165.211.33.194","method":"GET","location":"/job/3","status":"308","datetime":"2017-02-05T23:49:26.304Z"},{"date":"11/2/2017","time":"5:22:46","ip":"165.211.33.194","method":"DELETE","location":"/job/2/output","status":"204","datetime":"2017-02-11T04:22:46.304Z"},{"date":"24/2/2017","time":"20:14:15","ip":"165.211.33.194","method":"GET","location":"/other","status":"403","datetime":"2017-02-24T19:14:15.304Z"},{"date":"10/4/2017","time":"8:46:4","ip":"165.211.33.194","method":"POST","location":"/last","status":"401","datetime":"2017-04-10T06:46:04.304Z"},{"date":"23/4/2017","time":"18:56:24","ip":"165.211.33.194","method":"PUT","location":"/last","status":"409","datetime":"2017-04-23T16:56:24.304Z"},{"date":"8/5/2017","time":"7:5:31","ip":"165.211.33.194","method":"GET","location":"/job/3","status":"307","datetime":"2017-05-08T05:05:31.304Z"},{"date":"9/5/2017","time":"20:47:3","ip":"165.211.33.194","method":"POST","location":"/job/3","status":"200","datetime":"2017-05-09T18:47:03.304Z"},{"date":"12/6/2017","time":"18:54:43","ip":"165.211.33.194","method":"PUT","location":"/job/1","status":"200","datetime":"2017-06-12T16:54:43.304Z"},{"date":"22/7/2017","time":"12:27:41","ip":"165.211.33.194","method":"GET","location":"/job/1/output","status":"308","datetime":"2017-07-22T10:27:41.304Z"},{"date":"22/8/2017","time":"14:57:30","ip":"165.211.33.194","method":"PUT","location":"/job/1","status":"200","datetime":"2017-08-22T12:57:30.304Z"},{"date":"19/9/2017","time":"16:43:38","ip":"165.211.33.194","method":"OPTIONS","location":"/job/2/output","status":"404","datetime":"2017-09-19T14:43:38.304Z"},{"date":"9/11/2017","time":"3:7:2","ip":"165.211.33.194","method":"OPTIONS","location":"/job","status":"404","datetime":"2017-11-09T02:07:02.304Z"},{"date":"22/11/2017","time":"8:16:0","ip":"165.211.33.194","method":"OPTIONS","location":"/last","status":"200","datetime":"2017-11-22T07:16:00.304Z"},{"date":"22/11/2017","time":"16:0:27","ip":"165.211.33.194","method":"DELETE","location":"/job/2/output","status":"403","datetime":"2017-11-22T15:00:27.304Z"},{"date":"28/11/2017","time":"11:30:26","ip":"165.211.33.194","method":"GET","location":"/next","status":"403","datetime":"2017-11-28T10:30:26.304Z"},{"date":"30/11/2017","time":"8:56:47","ip":"165.211.33.194","method":"POST","location":"/resource2","status":"202","datetime":"2017-11-30T07:56:47.304Z"},{"date":"21/12/2017","time":"20:2:44","ip":"165.211.33.194","method":"POST","location":"/","status":"404","datetime":"2017-12-21T19:02:44.304Z"},{"date":"25/12/2017","time":"23:20:53","ip":"165.211.33.194","method":"PUT","location":"/other","status":"200","datetime":"2017-12-25T22:20:53.304Z"},{"date":"26/12/2017","time":"15:29:46","ip":"165.211.33.194","method":"DELETE","location":"/first","status":"405","datetime":"2017-12-26T14:29:46.304Z"},{"date":"3/1/2018","time":"17:50:44","ip":"165.211.33.194","method":"OPTIONS","location":"/job/3","status":"404","datetime":"2018-01-03T16:50:44.304Z"}]}